title,date,body
"EqualLogic Co-Founder Paula Long’s Latest Startup, DataGravity, Launches","Aug 19, 2014 12:01 am ET","By Deborah GageAug 19, 2014 12:01 am ET0 COMMENTSSerial entrepreneur Paula Long has a new venture: DataGravity Inc. DATAGRAVITY INC.Serial entrepreneur Paula Long, one of the few females who has started hard-core technology companies that sell products to businesses, released more details on her latest venture—DataGravity Inc., a startup that is using technology to bring intelligence to data storage.Ms. Long previously co-founded EqualLogic Inc., a storage area networking company that was acquired by Dell Inc. in 2008 for about $1.4 billion. That price was more than 10 times EqualLogic’s trailing revenue and became at the time Dell’s largest purchase ever, according to The Wall Street Journal.Her new company so far has raised $42 million from investors including General Catalyst Partners, Andreessen Horowitz and Charles River Ventures (also an investor in EqualLogic).DataGravity is preparing to ship a storage array that Ms. Long said can tell you about the data you have—who’s reading it, who’s writing it, what’s changed with it and so on. Older storage arrays may also have some of that knowledge but were not designed to surface it because the impact on performance was too great.Such arrays are full of “bridges to nowhere,” she said. “Data gets to a certain point and there’s no way to get it to the next point….It seems obvious that storage should be automated, but we needed a new architecture. We needed to think about the problem differently.”Beta customers, which include two law firms and a retailer, keep finding new questions to ask about their data as they learn more about it, according to co-founder and President John Joseph, who also worked at EqualLogic. One law firm, for instance, is using it to find potential conflicts of interest between attorneys.He said he expects DataGravity to “reshape work flow between people in business functions, not just in IT” as they learn new ways to work with their data and cooperate while doing it.Board member Peter Levine said he was introduced to Ms. Long by a mutual friend at about the same time that he joined Andreessen Horowitz, which was in 2011–not so he could invest in her company, but so she could help him vet potential storage deals.He called her “probably the most knowledgeable person in storage I’ve ever met,” despite his own deep background in storage, and said he was “blown away” when he saw the product.For instance, he said, DataGravity can “know when somebody is trying to open a file or access a file before they ever access a file. It’s always afterward that people have forensics [but] this fundamentally changes how you think about data sitting on a system…and that’s just one little piece.”DataGravity plans to ship its product, the DataGravity Discovery Series, in October. Ms. Long said she assumes her competitors will include Nimble Storage Inc. and Tintri Inc. Although the idea that her company will also compete with storage giants EMC Corp. and NetApp Inc. is flattering, she said, “it will take us awhile to get those creds.”As for being a woman working in enterprise tech, which is still mostly male, Ms. Long, who’s DataGravity’s chief executive, said it’s important for female entrepreneurs to talk about their successes and not just their struggles.Being an entrepreneur is hard for everybody, male or female, she said, and “success makes it easier for females to understand that they can be successful too….Don’t be apologetic.”Write to Deborah Gage at deborah.gage@wsj.com. Follow her on Twitter at @deborahgage "
Turning Employees Into Ethics Believers,"Sep 26, 2014 9:33 am ET","By Ben DiPietroSep 26, 2014 9:33 am ET0 COMMENTSA strong ethical culture at a company is widely seen as a bulwark against compliance failures, because it makes employees more prone to question what they see as unethical behavior.ISTOCKPHOTO.COM Which road to choose?At the same time, it’s hard to go about establishing such a culture. Enron Corp. famously had a high-sounding code of ethics that failed to deter its executives from an accounting fraud that brought down the company.Kellogg and Dell Inc. decided they needed to embed their codes of ethics more effectively within their businesses. Both companies opted to endorse aspirational sets of values but then went about promoting the codes in different ways, with Kellogg focusing on targeted training and Dell employing blogs, social media and even a game.Kellogg’s original version was a “be nice” code with “some aspiration in it, but not to the extent we were interested in,” said Jim Sholl, vice president of internal audit and compliance. Working with ethics and culture advisory firm LRN, he said the company wanted to make the code less a series of rules and to incorporate all its longstanding “K Values” of integrity, accountability, passion, humility, simplicity and results. “The prior code concentrated on one of the K values—integrity—and we wanted to touch on all K values in the new code,” he said.The company went through each section of the code, picking out what was relevant in terms of each K value. It structured the revised code so employees could refer to it on a daily basis as they worked through ethical issues, and it included real-life examples of situations in which employees could find themselves, Mr. Sholl said.Once Kellogg rolled out its code at the end of 2012, the focus shifted to training, said Emeka Nwankpah, Kellogg’s director of ethics and compliance. There is now overarching training for all employees and targeted training for specific workers depending on their level and the audience with which they interact, he said. This approach allows people to “have the right awareness, the right knowledge base, then blend that in with the overarching values we have,” he said. “Together, that should guide their decisions, which should lead to better outcomes.”Dell, which overhauled its ethics code in 2010, wanted to reinvent its code to emphasize the relevance of ethics and compliance to business performance and make employees more accountable for their decisions.Dell Chief Ethics and Compliance Officer Mike McLaughlin said the aim of the new approach to the code of ethics was to get employees to be “believers” rather than “obeyers.” While both believers and obeyers need to follow the rules, having believers makes them ambassadors for the company’s ethics and values and gets them to inspire others to do the right thing. “They feel a sense of pride,” he said. “I think if they’re infused with that kind of pride it helps with their interactions with customers and others. It shows externally and internally.”Mr. McLaughlin said it was important to deepen employee engagement with ethics and compliance so subjects such as data privacy rules or anti-corruption laws could be tied more closely to business outcomes. To accomplish that, the company made its code more aspirational in tone. “The code is the foundation of what we’re trying to do,” he said. The changes “take it to the next level so employees can feel to the core that these issues matter every single day.”To get more buy-in from employees, Dell asked employees worldwide for input, so when the code was released it would “truly feel to them what we believe in, as opposed to being told what you should believe in,” said Mr. McLaughlin. The message was spread through various channels, including blogs, social media and even a game developed by LRN called the Honesty Project.The game is designed to reinforce the lessons of why ethics and compliance are important by allowing employees to describe the damage corruption and bribery causes, recognize red flags that may indicate corruption or bribery and identify who to contact if they are asked to pay a bribe or witness a bribe being paid. In the first six days after the game was introduced, more than 5,200 employees completed it—some taking it more than once.To measure how effective the effort has been, Dell sent out a voluntary survey to its employees, and received back more than 33,000 responses, Mr. McLaughlin said. “In that data we’ve seen employees with increased engagement and awareness of these topics,” he said.Write to Ben DiPietro at ben.dipietro@dowjones.com, and follow him on Twitter @BenDiPietro1."
The Best Laptops to Buy Now,"Updated Aug. 5, 2014 7:45 p.m. ET","I can rely on a few things in life. The sun rising in the east, my overpriced morning Starbucks latte, and people asking me, ""What laptop should I buy?"" as summer winds down. I can also rely on my usual four-word answer: Get a MacBook Air.No other laptop in its price range has yet to beat Apple's masterful mixture of speed, endurance..."
An Obscure George Barris Car Surfaces in Washington State,"Dec. 2, 2014 1:19 p.m. ET","Article Not SupportedWe're sorry but this article contains media that is not currently supported in this app. You will be redirected to the article on wsj.com in 5 seconds.If you are not redirected automatically, click this link...."
Bet on Failed Bank Creates Windfall,"Updated July 22, 2014 8:57 p.m. ET","An investment group backed by John Paulson, George Soros, Michael Dell and Christopher Flowers stands to gain more than $3 billion from a bet made on a failed lender during the depths of the financial crisis.The group's 2009 purchase of OneWest Bank, formerly known as IndyMac Bank, will produce a return of 3.35 times its initial investment,..."
GE to Acquire Milestone Aviation for $1.78 Billion,"Updated Oct. 13, 2014 2:30 p.m. ET","General Electric Co. on Monday agreed to pay $1.78 billion for the world’s largest helicopter leasing company, linking its interests in aviation and energy and highlighting a fast-growing specialty finance area that has attracted some of the largest names in private equity.The proposed acquisition of Ireland-based Milestone Aviation Group Ltd. gives GE access to the market for almost 2,000 large helicopters ferrying workers and supplies to offshore oil and gas platforms. The U.S. company’s engines power some of the new..."
Dell XPS 13 Review: The MacBook Air Meets its Match,"Jan. 20, 2015 3:23 p.m. ET","For years, laptop makers have been playing catch-up with the hardware in Apple’s slender $1,000 MacBook Air. With the 2015 version of the XPS 13, Dell has finally matched it.I tested a slate of the latest 13-inch performance laptops from..."
The Two-Day Laptop Battery Is Here,"Updated Jan. 21, 2015 3:42 p.m. ET","The Two-Day Laptop BatteryScrambling to recharge laptop batteries is a huge annoyance. But new models from Acer, Apple, Dell and Lenovo can keep going and going. Personal Tech columnist Geoffrey A. Fowler finds which one lasts the longest.By Geoffrey A. FowlerUpdated Jan. 21, 2015 3:42 p.m. ET23 COMMENTSIn the span of two days last week, I traveled back and forth to the office twice, wrote this column, streamed two episodes of “Sherlock,” drank seven cups of coffee and recharged my phone four times. I never once plugged in my laptop.Laptops have a new talent: ultra-marathoning. Computers coming this winter can last up to 22 hours on a single charge. That’s enough battery for two full days of work…or one really, really bad day.MOREHow We Test Laptop BatteriesDell XPS 13 Review: The MacBook Air Meets Its MatchBattery life is the ultimate party pooper. No matter how amazing my shiny new phone, laptop, camera or watch might be, I still have to run around finding a place to plug it in. On my last business trip, I had to pack a power strip.We demand the impossible from our gadgets—to be fast, light as a feather, cheap, with enviable looks and batteries that go on and on. Here’s the thing: With laptops, at least, we’re actually getting close to having it all.You’ve long been able to buy a battery that was so big it transformed your laptop into a luggable desktop. But the latest 13-inch laptops from Apple, Acer, Dell and Lenovo pack enough oomph to do real work in a package you can hold in one hand. I borrowed them all, then unplugged them.A $108 external battery helps extend the battery life of the Dell XPS 13 to over 18.5 hours. PHOTO: JASON HENRY FOR THE WALL STREET JOURNALThe laptop with the most stamina, by far, is the Lenovo ThinkPad X250. Shipping next month for $1,150 and up, the model I tested will be offered with an extra-large removable battery that helped it last over 21-and-a-half hours in one of my stress tests.The laptop that most won my admiration is the new $800-and-up Dell XPS 13. Its battery clocked in at about 12 hours, then went to more than 18.5 hours with the help of a separate $108 power companion. What’s remarkable is that the Dell does this in a 2.6-pound form that’s cheaper, smaller and even a bit lighter than the famously svelte $1,000 13-inch MacBook Air. (Without the companion, Dell’s battery also lasted just a hair longer than the Air.)The Dell XPS 13 is the laptop to beat in 2015, at least until we see what Apple has in store when it redesigns the MacBook Air, which hasn’t changed in style since 2010.How did laptops get to two-day territory while smartphones still struggle to make one? They face different challenges. Phones waste a lot of juice connecting to cell networks and have far less space to stash batteries. But laptops have to do a lot more processor-demanding work and have larger screens.Much of the recent improvement in laptop life can be attributed to the efficiency of the processors inside them. The latest models from Acer, Dell and Lenovo contain a new kind of processor from Intel , 5th Generation Core, that adds about 90 minutes of battery life, compared with last year’s laptops. And older models, like the current MacBook Air, contain last-generation Intel chips that still provided a massive 50% battery boost over anything from early 2013 or before.Processors have learned how to turn off more and more nonessential functions when you don’t need them. Why be ready to crunch the numbers to render 3-D imagery when all you’re doing is scanning top-10 lists of cats?From left to right: an Acer, Lenovo ThinkPad, Apple MacBook Air and Dell. PHOTO: JASON HENRY FOR THE WALL STREET JOURNALAnd processors aren’t the only battery hogs. Displays and wireless radios drain juice, and other factors affecting battery life include the operating system, the type of storage, and, of course, the size and density of the battery.Because we all use laptops differently, there’s no perfect battery test. Companies make claims based on tests that don’t necessarily reflect real life. That’s why their lawyers make them stick lots of asterisks on their ads.To cut through the confusion, and achieve the results I discussed above, I used a trio of tests. First, I played a never-ending loop of nature videos stored on their hard drives, simulating the movie marathon you might queue up on the world’s longest flight. Second, I ran a program (developed by the industrywide Embedded Microprocessor Benchmark Consortium) in their Web browsers to load and scroll through some of the most popular sites over and over again. Finally, I just used them in my life. (You can read more about these tests here.)Here are the battery-life dimensions you should consider when buying a laptop in 2015:Chips: Processors have become so efficient, any road warrior will want a laptop made no earlier than June 2013, when Intel’s 4th Generation Core came out. And if you can, get one with this year’s 5th Generation Core. Intel and its laptop-building partners don’t make it easy to spot the difference—for this year’s models, the name of the processor should include “5th Generation” or read “5000-something.”There’s another kind of processor, called Core M, that consumes less energy but also has less processing power for demanding work. Makers tend to use it in ultra-portable laptops that weigh less, with smaller batteries that can’t last as long. Toshiba ’s upcoming Core M laptop, the Portégé Z20t, is expected to get 17.4 hours of battery life. (The company couldn’t get me one to test in time for this review.)The Lenovo ThinkPad X250 lasted over 21.5 hours in the Journal’s testing. PHOTO: JASON HENRY FOR THE WALL STREET JOURNALScreens: The bigger, brighter and sharper your screen, the harder your battery will have to work. If you want any laptop to last longer, crank down the brightness on the screen. I used a light meter in all my lab tests to put them on equal footing, which meant setting most of them to roughly 70%.Resolution, too, plays a role in power performance. It’s no surprise that the Lenovo had the lowest resolution of the group, though it was passable. There has yet to be a high-resolution MacBook Air, either. The Acer I tested has a high-res touch screen—and poorer battery life.In my tests, a Dell XPS 13 with a relatively standard 1920x1080-pixel screen lasted about four hours longer than one with a Quad HD+ 3200x1800-pixel display. (I also find these higher-resolution screens maddening to use with Windows 8, which can make some apps look impossibly tiny.)Watt Hours: Every system may draw on a battery differently, but not all batteries are created equal, either. These days, battery capacity is measured in watt hours (Wh). Dell’s XPS 13 includes a 52 Wh battery, while Lenovo packs two in the X250—a 23.2 Wh internal and a 72 Wh add-on.Batteries still have a problem with losing capacity with repeated use. I noticed a degradation even in the three weeks I tested these laptops. Laptops that let you swap in new batteries, like the Lenovo ThinkPad, make it easier to deal with the inevitable decline than those that bury the batteries deep inside, like the MacBook Air and Dell XPS 13.Design: Different theories about where to stash those batteries also impact the shape and weight of laptops. No doubt about it, the 72 Wh add-on battery gives Lenovo’s ThinkPad X250 a hefty backside—and brings the total weight to 3.6 pounds. It’s still lighter than most laptops from just a few years ago, but I could feel it tugging in my bag.Dell gets to two-day battery territory by selling that optional power companion, a 43 Wh carry-along battery backup. Surprisingly, it was a huge success in my real-world test. I liked having it in my backpack as a security blanket for my laptop’s battery life, and as a way to charge my phone and tablet via USB. If one more thing can save me from carrying three extra chargers, I’m game.Write to Geoffrey A. Fowler at geoffrey.fowler@wsj.com"
Dell Venue 8 7000 Review: A Thin Tablet With Real Depth,"Jan. 6, 2015 1:00 p.m. ET","There was a time, not too long ago, when taking photos with a tablet was as uncool as wearing a fanny pack. “Enjoying the view?” I’d joke when I saw tourists snapping away, their faces entirely covered by the big screens.Except tablet photography actually is catching on. Apple made a big deal about the improved camera in the iPad Air 2 and even enlightened us on the benefits of using a big high-res display as a viewfinder. And now,..."
How to Turn a Computer Monitor Into a TV,"March 20, 2015 2:24 p.m. ET","Q: I’m in the process of outfitting a second home and am considering going TV-free there. (Radical, I know.) We’ll have a desktop computer that we can stream movies to, but we don’t want it in the living room, nor do we want to have to watch around a desk. Any solutions?A: How about using your monitor as a TV in the living room but leaving your computer behind? The tidiest way to pull this off is with a tiny streaming video player, like the Roku Streaming Stick, Google Chromecast or Amazon Fire TV Stick. These cost..."
