title,date,body
U.S. Firms Slash Interest Tab in $100 Billion Refinancing Blitz,"Updated Feb. 8, 2017 7:22 a.m. ET","Blackstone owns Service King Collision Repair Centers PHOTO: BRENDAN MCDERMID/REUTERSBy Matt WirzUpdated Feb. 8, 2017 7:22 a.m. ET8 COMMENTSRising interest-rate expectations are fueling the biggest corporate-refinancing boom in years.U.S. companies refinanced $100 billion of loans in January, the largest monthly total in at least a decade, according to data from S&P Global Inc. SPGI -2.32% More than 110 low-rated companies, including software giant Dell Technologies Inc. and car-repair chain Service King Collision Repair Centers Inc., have refinanced loans since October, according to data from LevFin Insights LLC.Borrowers in recent months have saved more than $1 billion in annual interest costs by renegotiating terms with their lenders, according to a Wall Street Journal analysis of the data.The wave is being propelled by outsize investor demand for bank loans, floating-rate debt investments that are prized because they tend to perform well in rising-rate environments. The red-hot loan market has enabled many corporations to demand that lenders cut rates or face losing the business to a rival, a sign of how easy financing is enabling large firms to get advantageous terms in debt markets.Persuading lenders to cut the rate on Service King’s $609 million loan by 0.75 percentage point took just a few days. The new loan will save the company about $4.5 million in annual interest expense that can be used for acquisitions instead, said Chief Financial Officer Michelle Frymire.“There’s a lot of pent-up investor demand,” Ms. Frymire said. The Richardson, Texas, company has 309 auto repair shops in 23 states and is owned by private-equity firm Blackstone Group LP.Unlike bonds, most of which pay a fixed interest rate until they mature, loans pay floating interest rates calculated as a premium, or “spread,” over the London interbank offered rate. Interest climbs with benchmark rates, typically making the loans more attractive to investors and more expensive for borrowers, when the Federal Reserve increases rates.Reflecting immense demand for the loans, borrowing costs are actually dropping at present. The risk is that the feeding frenzy pushes spreads so low that investors no longer earn enough income to offset the risk of default. Yet with U.S. and global economic activity showing signs of warming up, defaults remain low and few analysts are concerned that a recession is imminent.Investors have poured $17 billion into loan mutual funds since Sept. 1, with $7.6 billion coming in December alone, according to data from Lipper Inc. It is the biggest such inflow since 2013, during the “Taper Tantrum” when the Fed’s plan to reduce stimulus fueled a surge into loan funds.With few new loans to buy, fund managers who received new money from investors are scrambling to buy existing loans, pushing prices higher and spreads down. Companies and their investment bankers saw the opportunity to refinance and pounced.“Animal spirits seem to have taken over investor appetite and the markets,” said Craig Russ, co-manager of Eaton Vance Corp.’s $7.5 billion leveraged-loan mutual fund.While large banks still underwrite large corporate loans, they often sell the bulk of the debt to a mix of mutual funds, pensions, insurers, hedge funds and other institutional investors.Total repricings since the start of October amount to $222 billion, representing 24% of all outstanding leveraged loans, according to LevFin Insights. Firms negotiated an average interest reduction of 0.59 percentage point.Even new loans, which companies are typically prohibited from refinancing for at least six months, have been caught up in the repricing wave.Dell borrowed $5 billion in September at a rate of 4% to help pay for its $60 billion purchase of EMC Corp. In January, Dell and its bankers asked investors to agree to a 0.75 percentage-point rate reduction, with the caveat that the change would only take effect in March, coinciding with the end of the six-month rate lock. As a sweetener, the company agreed to increase the loan by $500 million and issued the debt at a slight discount.“Some of our investors feel like they’ve been run over by a train,” said Jeff Cohen, co-head of Credit Suisse Group AG’s leveraged-loan department.Loans could fall back out of fashion if economic growth falters, making rate increases less likely. Investors put $63 billion into loan funds in 2013, then pulled $45 billion out over the following two years, according to Lipper.But even deals previously deemed risky have been drawing strong demand. When talent agency William Morris Endeavor Entertainment LLC and several private-equity firms used $1.8 billion of leveraged loans for their buyout of Ultimate Fighting Championship in August, the deal drew fire from bank regulators for being too aggressive. The Fed told arrangers Goldman Sachs Group Inc. and Deutsche Bank AG that the deal might violate guidelines about how much debt could be used for the purchase, The Wall Street Journal has reported.Despite the warnings, UFC persuaded holders of its loans in January to reprice lower by 0.75 percentage point, using the markets arms of one of its owners, KKR & Co., to step in for the banks and arrange the transaction.“Investors are sitting on a big heap of cash and there’s not a whole lot of places they can go with that money,” said Cade Thompson, director of debt capital markets at KKR.Write to Matt Wirz at matthieu.wirz@wsj.comAppeared in the February 9, 2017, print edition as 'Companies Race to Refinance Debt.'"
Iron Mountain CTO Set to Claim Outgoing CIO’s Responsibilities and Lead Digital Expansion,"Feb 15, 2017 3:12 pm ET","By Steven NortonFeb 15, 2017 3:12 pm ET0 COMMENTSA group tours an Iron Mountain Inc. archival facility in Hollywood, Calif., July 20, 2016. PHOTO: TROY HARVEY/BLOOMBERGIron Mountain Inc. has appointed its first chief technology officer in an effort to expand its tech leadership and reach customers who increasingly use digital tools to store and manage corporate records and other data.Fidelma Russo will join the storage and information management services firm in March as a member of the company’s senior executive team, reporting to President and CEO William L. Meaney. The new role encompasses internal IT as well as more customer-facing roles in product and services development.Fidelma Russo joins Iron Mountain from Dell EMC, where she was senior vice president and general manager for the companys enterprise storage and software business. PHOTO: IRON MOUNTAINThat includes taking over the responsibilities of Tasos Tsolakis, who will step down from his role as chief information officer and EVP of global services on March 31. In a November 2016 announcement detailing his planned departure, the company said his responsibilities would be handed over to the new CTO.“Traditionally we’ve had CIOs who were more inwardly focused, ensuring that we have the right systems to support our operations more efficiently,” an Iron Mountain spokesman said in an email. With the CTO appointment, “we are widening our approach to how we leverage technology from an internal and external standpoint.”Ms. Russo joins Iron Mountain from Dell EMC, where she was senior vice president and general manager for the company’s enterprise storage and software business. Prior to joining EMC, she was chief operating officer for Sepaton/HDS, a storage and software products and services provider. There she worked on growing the company’s data protection products and helped raise more than $25 million in venture funding, Iron Mountain said in a statement.“Our customers increasingly want greater control over and value from the information and other assets they trust us to store and manage,” Mr. Meaney said in a press release. “Fidelma and her team will ensure we deliver on those expectations.”Write to steven.norton@wsj.com"
"PCs: Q1 Shipments a Bit Better, Says IDC; Actually, A Bit Worse, Says Gartner","Updated April 11, 2017 4:47 p.m. ET","Q1 personal computer sales are in from the two main keepers of data, research firms Gartner and IDC, and whether you believe things are getting better or getting worse depends on whom you believe.IDC said sales rose 0.6% from the first quarter of last year, the first growth for the market in five years, at 60.3 million.Gartner said sales fell 2.4%, and that shipments fell below 63 million for the first time since 2007, at 62.2 million.Both firms agree that the area of health was the corporate PC market, while the consumer market continues to deteriorate — Gartner even says some consumers have abandoned PCs forever to use phones and tablets instead.And both agree that HP Inc. (HPQ) had the best growth among the top five vendors, followed by Dell.Another factor is at work here: rising component prices. Both firms indicate that vendors built inventory of PCs as prices of chips such as DRAM rose.HP had 6.5% unit shipment growth, year over year, according to Gartner, while IDC had them rising by 13%. In IDC!'s view, HP regained the top market share in PCs for the first time in four years, while Gartner still has them trailing Lenovo Group. Fourth place Asustek was down 14% according to Gartner, while IDC actually has Apple (AAPL) in fourth place, followed by Acer.Gartner said Apple's sales rose by 4.5%, while IDC recorded a similar 4.1% growth.Gartner, describing the situation, remarks that,The PC industry experienced modest growth in the business PC market, but this was offset by declining consumer demand. Consumers continued to refrain from replacing older PCs, and some consumers have abandoned the PC market altogether. The business segment still sees the PC as an important device, and it's the main work device for businesses.IDC analyst Jay Chou stated that the PC market is at the beginning of a corporate refresh cycle that bodes well:The traditional PC market has been through a tough phase, with competition from tablets and smartphones as well as lengthening lifecycles pushing PC shipments down roughly 30% from a peak in 2011. Nevertheless, users have generally delayed PC replacements rather than giving up PCs for other devices. The commercial market is beginning a replacement cycle that should drive growth throughout the forecast. Consumer demand will remain under pressure, although growth in segments like PC Gaming as well as rising saturation of tablets and smartphones will move the consumer market toward stabilization as well.Regarding the build-up in inventories, IDC states, ""Apart from factors such as relatively improved commercial PC performance as well as a few component shortages, which continued to add to a better inventory situation, the overall PC performance for the quarter remained fairly sublime.""Gartner expects those rising component prices will keep PC prices unattractive to consumers, further hurting consumer demand."
HPE to Acquire Data-Storage Startup SimpliVity for $650 Million in Cash,"Updated Jan. 18, 2017 7:24 a.m. ET","Hewlett Packard Enterprise Co. said Tuesday it would acquire data-storage startup SimpliVity Corp. for $650 million in cash, a steep discount to the startup’s most recent $1 billion valuation.SimpliVity, founded in 2009, combines storage, computing and networking in the same box, essentially a server. This category of hardware, known as hyperconverged systems, is a fast-growing segment of an otherwise declining world-wide server..."
Katz’s Delicatessen to Launch World-Wide Shipping Service,"May 10, 2017 5:30 a.m. ET","For 129 years, Katz’s Delicatessen has served New Yorkers hefty portions of classic Jewish-style fare.Now, it is looking to broaden its customer base and deliver pastrami to Pakistan and corned beef to Colombia, among other global locales.The deli, a fixture on Manhattan’s Lower East Side, is launching a world-wide shipping service in..."
Dell Bets $1 Billion on ‘Internet of Things’,"Oct. 10, 2017 11:00 a.m. ET","Dell Chief Executive Michael Dell at an event earlier this year. PHOTO: SIMON DAWSON/BLOOMBERG NEWSBy Rachael KingOct. 10, 2017 11:00 a.m. ET6 COMMENTSDell Technologies Inc. DVMT -0.89% is joining the crowded field of companies wagering big money on the so-called Internet of Things, as the computing giant looks for new avenues of growth amid a shift in corporate spending to the cloud.The Round Rock, Texas, company said Tuesday it will commit $1 billion over three years in research and development to create hardware and software that helps manage billions of everyday devices connected to the web.Once the largest personal-computer maker, Dell is now known as much for its corporate products like storage, servers and security software following last year’s deal to buy EMC Corp.Dell is looking for areas where it might grow as customers increasingly buy computing and storage over the Web from the likes of Amazon.com Inc.’s AMZN -5.21% Amazon Web Services and Microsoft Corp. while spending less on their own data-center hardware.Corporate spending on data center hardware and software from Dell, Hewlett Packard Enterprise Co. and others is forecast to grow less than 3% to $178 billion in 2020 from this year, according to research firm Gartner Inc. In contrast, companies are projected to increase spending on cloud infrastructure services by about double to $70 billion by 2020.As the cost of sensors in everything from thermostats to connected cars continues to plummet, Dell is betting there will be an associated boom in computing hardware and software that sits close to these devices, known as edge computing.“We think edge computing could be 100 times bigger than the internet as we know it today,” said Chief Executive Michael Dell in an interview. “That may sound crazy right now but give it a few years and I think that will be more understood.”There is some method to Mr. Dell’s madness. It is cheaper and more efficient to process information coming from sensors closer to where it originates rather than sending that data back to the cloud, said Patrick Moorhead, president of Moor Insights & Strategy. An autonomous car or a robot surgeon needs to process information in real-time and they wouldn’t tolerate delays that occur when processing information in a remote cloud.Dell is looking for areas where it might grow as customers increasingly buy computing and storage over the web. PHOTO: BOBBY YIP/REUTERSPart of Mr. Dell’s bet is that corporations will want to keep control of valuable data. An auto maker, for example, will want all that data from autonomous vehicles to be stored on their own equipment and not on someone else’s server. That data serves as a company’s crown jewels and needs to be secured, protected and managed, Mr. Dell said.As mobile carriers begin to implement fifth-generation wireless networks, it will make it easier for edge-computing devices to communicate with one each other, Mr. Dell said. For that piece, Dell is counting on subsidiary VMware’s network virtualization and security software called NSX.Dell will also rely on another subsidiary, Pivotal, as it targets corporate customers working in the Internet of Things.  General Electric Co. , for example, came to Pivotal to use its software to create its Predix platform which collects and analyzes data from industrial machines.In addition, Dell Technologies Capital, the company’s venture investing arm, has stepped up investments over the past six months in related companies including Otonomo, a connected-car data exchange marketplace, and Zingbox which makes Internet of Things device security, Dell said.Dell is somewhat late to the trend, at least in earmarking significant investment toward products. A number of tech giants including Amazon, Microsoft, Cisco Systems Inc., Hewlett Packard Enterprise and Samsung Electronics Co. have all in the past year planted their flag with new platforms or committed R&D investments.Write to Rachael King at rachael.king@wsj.com"
"For Heavily Indebted Firms Like Dell, Tax Bill Delivers a Downside","Updated Dec. 21, 2017 10:17 a.m. ET","Last year, just before he closed the biggest technology merger in history, Michael Dell was asked how he would feel waking up and being nearly $50 billion in debt. His reply: “We do everything bigger in Texas.”Now, Mr. Dell’s costs on that debt are about to get bigger.The tax overhaul expected to become law soon will limit the tax deduction..."
"Group Including Apple, Dell Moves to Buy Toshiba’s Chip Business","Updated Sept. 13, 2017 7:37 p.m. ET","Toshiba is seeking to unload the chip unit. PHOTO: KIYOSHI OTA/BLOOMBERG NEWSBy Dana Mattioli andDana CimillucaUpdated Sept. 13, 2017 7:37 p.m. ET7 COMMENTSA group including Apple Inc. and Dell Technologies Inc. DVMT -0.89% surged to the front of a hotly contested race to acquire Toshiba Corp.’s TOSYY -1.80% memory-chip business, a crucial supplier to some of the world’s biggest makers of electronic gear.Toshiba said Wednesday it had signed a nonbinding agreement with the leader of the group, private-equity firm Bain Capital, and intends to reach a deal by the end of September. The bid values the business at about $19 billion, according to people familiar with the matter.The development is the latest twist in a global auction that has pitted three major bidders against each other and exposed a rift between Toshiba and a key partner, Western Digital Corp. WDC -2.47% , which is also vying for the business. At stake is control over a key building block in everything from smartphones to heavy-duty computing machines.Toshiba is racing to strike a deal in the wake of huge losses at its U.S. nuclear unit, Westinghouse Electric Co., which filed for bankruptcy earlier this year. The Tokyo company has said it needs to sell the profitable memory unit to bring its shareholder equity back into positive territory by the end of its fiscal year in March 2018. Otherwise, its shares would face delisting under Tokyo Stock Exchange rules.Besides Apple and Dell, the Bain group includes disk-drive maker Seagate Technology PLC and others, and more tech and financial players may join, according to people familiar with the matter. It also includes South Korean chip maker SK Hynix Inc., as well as Innovation Network Corp. of Japan, a fund backed by the Japanese government, and government-owned Development Bank of Japan, other people said.RELATEDTrump Blocks Lattice DealHeard on the Street: Western Digital’s PainFight at Toshiba: Some Board Members Want Deal With FoxconnToshiba Revives Talks With Foxconn Over Chip UnitTokyo Takes Lead in Toshiba Chip-Unit Sale Over China FearsToshiba’s Westinghouse Electric Files for Bankruptcy ProtectionToshiba Agrees to Provide Notice to Western Digital in Chip-Unit SaleToshiba Hasn’t Revealed That SK Hynix Could Get Stake in Its Chip BusinessToshiba Bankruptcy Filing Pushed by Some Involved in WorkoutThe scrum highlights the strategic importance of the Toshiba business, which makes NAND flash memory chips used for data storage in smartphones, computers and other electronics.Apple and Dell, which would likely supply debt financing for a Bain bid, want to ensure the Toshiba unit remains a viable supplier, according to people familiar with the matter. The tech heavyweights also want the unit to stay competitive with Samsung Electronics Co. , the leader in flash memory chips and a major rival to Apple.“This shows the dire situation that the flash memory industry is in with high prices and low availability over an extended period of time,” said Patrick Moorhead, president of Moor Insights & Strategy. “Companies need this storage to ship and sell products at a profit.”The Bain consortium’s plan would be to take the chip business private as an independent entity and bring it public again at a later date in Japan, one person said.It is far from clear that a resolution to the monthslong saga is at hand. A number of constituents with disparate interests have to agree before a deal can be completed, and a host of regulators would have to sign off. In June, Toshiba selected a group including Bain and SK Hynix as the preferred bidder before those talks stalled. Toshiba, which said Wednesday that Bain had made a new offer, added in its statement that the memorandum doesn’t preclude talks with other bidding groups.Hot ChipsToshiba has struggled to reach a deal to sell its memory-chip unit.20003000Jan. 27, 2017Expecting a multibillion-dollar loss over U.S. nuclear-reactor builder Westinghouse, Toshiba says it will sell part of its memory-chip business.Source: staff reportsAt various points in the negotiations, Toshiba has leaned toward another bidding group that includes Western Digital, a U.S. maker of hard-disk drives that is the Japanese company’s partner in the memory-chip business. But the parties haven’t been able to agree on how much influence Western Digital would have following a deal.They are now openly at odds, with Western Digital insisting it has veto rights over any sale and Toshiba saying that isn’t true. The two sides are headed for international arbitration.A spokeswoman for Western Digital, which has joined buyout giant KKR & Co. on a bid, said the company is “disappointed” by Toshiba’s move and still wants to reach a deal.Meanwhile, the Japanese government has raised objections to another bid led by Foxconn, formally known as Hon Hai Precision Industry Co. , because of the company’s extensive operations in China. Some government officials believe Foxconn’s China ties could result in Japanese technology leaking to that country.Given how the deal has captivated Wall Street, some of those working on it have taken to calling it privately the “RJR Nabisco of tech”—a reference to the 1980s-era leveraged buyout memorialized in the book “Barbarians at the Gate.”Toshiba’s flash-memory chips are used not just in smartphones but also in servers for cloud services, internet-connected devices and other products, demand for which is on the rise. Whether Toshiba sells the unit to one of the three bidder groups or decides not to sell after all—still a significant possibility—that robust demand is the backdrop for the spirited sales process.In Toshiba’s results for the April-June quarter, sales for the segment that includes memory chips rose 23% and operating profit for that segment was greater than the company’s total operating profit.About 30% of the NAND supply in the new iPhones Apple unveiled this week comes from Toshiba—with 30% from Western Digital, 25% from SK Hynix and the rest from Samsung and Micron Technology , Inc., according to estimates by Susquehanna International Group. A Western Digital acquisition of Toshiba could give the U.S. company increased leverage at a time when NAND prices are already rising, some customers worry.The tech industry is at peak anxiety when it comes to flash memory, said Mr. Moorhead of Moor Insights. He added that a Toshiba deal would allow Apple and Dell, two of the world’s largest purchasers of flash memory, to guarantee supply at a lower cost.Regardless of which party Toshiba chooses, antitrust clearance is likely to be a hurdle because getting approval in major markets can take more than six months. That could make it difficult for a deal to close by March 2018, although a bidder might look for ways to get money into Toshiba’s hands before closing.—Tripp Mickle and Rachael King contributed to this article.Write to Dana Mattioli at dana.mattioli@wsj.com and Dana Cimilluca at dana.cimilluca@wsj.comAppeared in the September 14, 2017, print edition as 'Apple, Dell Join Bid For Toshiba Chip Unit.'"
