title,date,body
Windows 10 Laptops: In Search of Great Hardware to Match Great Software,"Aug. 11, 2015 2:07 p.m. ET","Listen really closely, and you can hear the cries of Windows laptop users.Windows 10 is truly great, but it doesn’t put an end to the affliction caused by inferior screens, carpal-tunnel-inducing trackpads, Tupperware-like plastic, short-lived batteries, crippling preloaded software…. I could go on.So where the heck is the great laptop..."
Dell CIO Paul J. Walsh Is Leaving the Company,"Nov 12, 2015 4:38 pm ET","By Steven NortonNov 12, 2015 4:38 pm ET0 COMMENTSPaul J. Walsh, Dell’s CIO, is leaving the company. DELLPaul J. Walsh, chief information officer at Dell Inc., is leaving the company, a Dell spokesman said Thursday.Scott Pittman, who leads Dell’s IT infrastructure services, will be interim CIO while the company looks for a permanent replacement.“Scott and Paul are working together to ensure a smooth transition for both our team members and our customers,” the spokesman said.Michael Dell promoted Mr. Walsh to CIO in September 2014 following the departure of Adriana “Andi” Karaboutis, who took a job at Biogen Mr. Walsh was previously vice president of Dell Commerce Services, where he oversaw the Dell.com website and implementation of sales systems and software to support customers. He joined Dell in 2013 from Sears Holding, where he was vice president and general manager for the retailer’s online business unit.His departure comes about a month after Dell and private-equity firm Silver Lake said they would buy data storage company EMC for $67 billion, the biggest technology takeover ever."
U.S. Tech Companies Cozy Up to China,"Sept. 13, 2015 6:47 p.m. ET","U.S. technology companies face a tough choice when it comes to doing business in China: Access to the country’s immense market increasingly requires helping local companies upgrade their skills, leading to deals that could turn erstwhile partners into entrenched competitors.The dilemma is especially apparent in advance of Chinese President Xi Jinping’s first state visit to the U.S. later this month, a trip that likely will come with..."
Your Next Computer Should Be a Desktop,"Updated Aug. 12, 2015 7:30 a.m. ET","I get asked for advice on very practical but personal matters. “How do I block my boss on Facebook?” “Can I take back an email I just sent my ex?”The most frequent question is: “Which laptop should I buy?” To me, that’s like asking which Lunchable to feed your first-grader. I like to answer by challenging the assumption that that’s all there is. Forget the laptop, have you considered a desktop?Even in our buzzing mobile..."
Microsoft Surface Book and Surface Pro 4 Review: New Hope for Windows Hardware,"Oct. 21, 2015 9:48 a.m. ET","I want to tell you about a very exciting, cutting-edge piece of technology. It’s a computer with a screen and a keyboard that fits in your lap. It’s called a… laptop!No, this isn’t a reprint of a column from the ’80s. It just turns out that the 30-year-old form factor is still the future of our computers. Here’s my proof: Tablets, which were supposed to mercilessly kill our old computers, are now sprouting keyboards and turning..."
Windows 10 or OS X? A Mac User Falls For the PC Again,"July 28, 2015 1:54 p.m. ET","Mac vs. PC: The Windows 10 EditionWith Windows 10, the PC has more in common with the Mac than ever. WSJ’s Joanna Stern parodies those classic Mac vs. PC ads—with a surprise 2015 twist. Photo/video: Drew Evans/The Wall Street Journal.By Joanna SternJuly 28, 2015 1:54 p.m. ET166 COMMENTSYou can blame Vista and the constant pounding of Ctrl+Alt+Del that came with it. Or you can blame those clever Mac vs. PC ads. But about eight years ago, after growing up with Windows computers and countless games of “Solitaire,” I bought my first Mac. And I never looked back.Until now.I’ve spent the past month solely using Windows 10, and I’ve fallen in love with Windows again. In fact, I’ve rarely missed Mac OS X. I’m more productive and faster at handling my many open windows on Microsoft ’s latest than on Apple’s. If you had told me a year ago that I’d write those words, I’d have said you’re on some mind-altering drug.Dell laptop and Apple MacBook Air PHOTO: F. MARTIN RAMIN/THE WALL STREET JOURNAL, STYLING BY ANNE CARDENASAfter unsuccessfully zigging for the past few years with Windows 8—which awkwardly layered a touch interface over old-school Windows—Microsoft has zagged back to the desktop it knows best with Windows 10.Available starting Wednesday as a free upgrade on Windows 7 and 8 PCs, it takes the traditional underpinnings and spruces them up with a modern design, a helpful personal assistant and better windows-management tools. Unlike Windows 8, it stays out of your way, just letting you do what you need to do better. It’s what Windows should be in 2015.It’s not surprising that I’ve fallen so hard for Windows 10. For nearly 30 years, the two computing rivals have picked and pulled features from each other. At this point, both Windows 10 and Apple’s upcoming Mac OS X El Capitan have so many nearly identical functions that at times it can feel like playing “Can You Spot the Difference?”Microsoft can at last boast that it does a superior job at many of the new tricks. There’s just one little problem: the iPhone.A Serious MultitaskerThe resurrection of the Start menu, after being killed in Windows 8, was practically celebrated with all-night dancing by Windows users, but the real party should be for Task View. The feature, which displays a shrunken snapshot of all your open windows and programs, has been the single most important feature in my transition back to Windows.That’s because the Mac has, for years, had a similar function called Exposé (now Mission Control) that I use constantly to jump between programs. Just like with OS X, you can access Task View on Windows by swiping three fingers up on a trackpad—if that laptop has a “precision trackpad” like on the Surface Pro 3 or new Dell XPS 13, that is.But even on that impressive Dell, the trackpad seems to require the touch of an angel to consistently work correctly. So I’ve come to rely on the keyboard shortcut (Windows key + Tab). You can also click on the three-rectangle icon in the taskbar.Apple MacBook Air running Windows PHOTO: F. MARTIN RAMIN/THE WALL STREET JOURNAL, STYLING BY ANNE CARDENASIronically, I found my MacBook Air to be the best Windows 10 laptop. It may not have a touchscreen, but it was snappier, and beat the Dell and Surface for normal scrolling and navigating. (The three-finger swipe wasn’t enabled during my tests, however.) Windows 10 is in desperate need of a worthy PC laptop.Another thing that’s made me a master Windows 10 multitasker is the ability to easily snap email to one side of the screen and a Web browser to the other. Microsoft included app-snapping in previous Windows versions, but now it suggests other open apps or windows to place next to it. It also lets you tile up to four windows on the screen. It’s a huge time saver, especially when helping herd the stray windows on my external monitor.The feature is so great, Apple put it in its next version of OS X and iOS for the iPad. But Microsoft’s implementation is better, in part because it has addictive keyboard shortcuts (see chart).Windows 10 includes virtual desktops that allow you to better organize your workspace: for instance, a zone for work (Excel and Outlook) and another for play (Twitter, Facebook and YouTube). I don’t use them though, not even on a Mac, which has had virtual desktops for six years.A Serious AssistantI’m now the Usain Bolt of Windows multitasking, but I’ve had a little help from the sidelines—quite literally. On the taskbar lives Cortana, Microsoft’s... Siri. But unlike Siri, Cortana predicts information you may want to know, based off of your email, calendar and searches. It’s a lot like Google Now.For instance, Cortana told me I had a workout class at 5:30 p.m. on my calendar and that I should leave in 15 minutes. However, she only has access to Microsoft’s Mail app, not Outlook, where my corporate mail lives, so she didn’t know I was flying to Hong Kong this week.Cortana’s greatest use to me has been in app launching and quick searches. She responds to spoken commands and questions when she hears her name—“Hey, Cortana, what’s the weather in Hong Kong?” or “Hey, Cortana, launch Spotify”—though it’s quicker to type. She can quickly search the Web (but only with Bing), and can answer some questions in the window.Apple still hasn’t brought Siri to the Mac, but the next OS X has an updated Spotlight that lets you do similar Internet-powered searches—weather, sports scores, stock quotes, etc.—right on the desktop.A Serious DisconnectWindows 10 lets you handle apps outstandingly well. The actual apps, however, aren’t so good. With the exception of OneNote, Microsoft’s note-taking app, almost all of Windows’ included apps lag behind Apple’s—and even Google’s—in features and design.The Mail app is unsightly and confusing—a far cry from the mail app Microsoft offers for the iPhone. The Photos app doesn’t include half the fun tricks of Google Photos or Apple Photos. It’s sad that Paint (which may not have been updated since the Reagan administration) is still your best bet for image editing. There’s no simple built-in video editor program. (Bring back Windows Movie Maker!) I haven’t found a single reason to use the new Groove Music. And Microsoft Office isn’t included, or even very well integrated at this point. (Plus, the new Office for Mac is finally on par with the Windows version.)This wouldn’t be such a bad situation if third-party apps picked up Microsoft’s slack, but that’s often not the case. While I was able to gather some of my essentials—Spotify, Wunderlist to-do app, Slack—either in the Windows Store or directly from software publishers, I never did find a Twitter app or cheap photo editor as good as what I use on my Mac.(You know what there isn’t a lack of? Windows anti-virus apps!) Microsoft made it easier for Android and iOS software to migrate to the new Windows, but the initiative hasn’t yet borne fruit.But most of us spend our computer time in a Web browser. (As Google’s Chromebooks show, even computers that are just browsers sell pretty well these days!) Microsoft hopes we’ll hop on its new Edge browser. It’s fast and cleanly designed, and does some cool things like automatically showing phone numbers, addresses and reviews when you hit certain restaurant or retailer sites, and letting you sketch directly on Web pages. But Edge’s periodic performance issues and lack of browser plug-ins meant keeping Google Chrome as my default browser.In fact, even on my Mac, I spend most my time using Google’s services. In most cases, they’re better, and unlike many of Apple’s, they’re easily accessible on Windows and the Web. Google is proving that you don’t need to own the OS to win.For Microsoft, Apple’s smash-hit smartphone is a bigger problem than Google’s services. Mac owners still might be a niche group, but millions of people own and love iPhones. There’s unprecedented iPhone support in Windows 10, and Microsoft has an abundance of solid iPhone apps that it will remind you about when you plug in your iPhone.The iPhone works with Windows 10, but not as well as it works with Mac OS X. PHOTO: DREW EVANS / THE WALL STREET JOURNALBut there will always be things I can’t do with an iPhone and a Windows PC, like pick up an incoming call right on my laptop, or easily iMessage my entire family. The iPhone has become the beating heart of so many of our digital lives, and Apple, in what I call the ecosystem trap, has engineered all its own devices to work better with it. With Windows 10, Microsoft has put a lot of muscle into getting its phones to integrate better—the only problem is that no one uses Windows Phones and things only seem to be getting worse. For Android phone owners, however, there’s never been a better time to own a Windows PC.Things change. The battle between Windows and OS X is far less important than it was a decade ago. Yes, both operating systems help you get more done than ever, but when our time is spent using apps and services across different-sized screens, the traditional computer screen is just one piece of the puzzle.Microsoft is simply missing too many of the other pieces for me to go back to a PC full time. Still, I’m keeping Windows 10 on my Mac—even if it’s just for a round of “Solitaire” every once in a while."
"Judge Finds Michael Dell, Silver Lake Underpaid for Dell in 2013","Updated June 1, 2016 10:01 a.m. ET","Michael Dell’s 2013 buyout of his computer company shortchanged shareholders by more than $6 billion, a Delaware judge ruled, vindicating critics of the controversial deal who argued it favored Mr. Dell and his partners.Spurred on by billionaire activist Carl Icahn, some shareholders had accused Mr. Dell of trying to snatch up Dell Inc. on the cheap just as it was poised for a rebound.What ensued was one of the most..."
NTT Data to Buy Dell’s IT-Services Arm,"March 28, 2016","TOKYO—Japan’s NTT Data Corp. said Monday it has agreed to buy Dell Inc.’s information-technology-services division for $3.05 billion, its latest effort to seek growth overseas.The deal would mark one of the largest foreign buyouts in recent years for NTT Data parent Nippon Telegraph & Telephone Corp., whose operations span fixed-line and..."
Computer Mogul Michael Dell Stands to Reap Billions From FCC Auction,"Jan. 13, 2016 12:01 a.m. ET","Billionaire Michael Dell has been scooping up local TV stations across the country in recent years. Now, he stands to make as much as $4 billion from a government effort to buy back those airwaves.In more than a dozen deals since 2011, a company controlled by Mr. Dell’s investment fund has spent about $80 million on independent TV stations, according to government records.The purchases include about $5 million for a..."
Dell Sells $20 Billion of Secured Bonds,"Updated May 17, 2016 6:11 p.m. ET","Dell Inc. sold $20 billion of secured bonds Tuesday, according to people familiar with the matter, taking a big step toward funding its blockbuster acquisition of EMC Corp.Despite concerns about Dell’s long-term prospects as a computer and data- storage company in a fast-changing tech landscape, investors jumped at the rare chance to buy..."
VMWare Plans to Buy Back $1.2 Billion in Shares After Dell Takeover Vote,"Updated April 19, 2016 8:13 p.m. ET","VMware Inc. is giving shareholders of its parent company EMC Corp. a little more incentive to approve a planned takeover by Dell Inc.VMware’s stock surged over 9% in after-hours trading Tuesday after the company reported solid quarterly results and said it would begin a $1.2 billion stock buyback. The repurchase is set to begin after EMC shareholders vote on the Dell acquisition, an event expected six weeks after Dell files its..."
Dell’s SecureWorks Aims to Launch IPO in April,"Updated April 1, 2016 4:52 p.m. ET","A cybersecurity firm owned by Dell Inc. is seeking to end the technology IPO drought.SecureWorks Corp., owned by Dell’s closely held parent, Denali Holding Inc., is seeking to launch its initial public offering in April, people close to the deal say. The company could begin its “roadshow” to market the stock to investors during the week of April 11, the people said. The shares are expected to trade on Nasdaq under the symbol “SCWX”,..."
Carl Icahn Doesn’t Get to Join in the Dell Bounty,"Jun 1, 2016 4:06 pm ET","Carl Icahn spent much of 2013 railing against the buyout of Dell Inc. He bought a big stake, suggested his own alternative plan, and urged fellow investors (sometimes in rhyme!) to reject what he called a grossly underpriced deal. On Tuesday, a Delaware judge agreed, ruling that Dell’s sale to founder and private-equity firm Silver […]"
NTT in Multibillion-Dollar Talks to Buy Dell’s Perot Systems,"March 8, 2016 3:29 a.m. ET","TOKYO—Japan’s largest telecommunications group, Nippon Telegraph & Telephone Corp., is in negotiations to purchase Perot Systems, the information-technology consulting division of Dell Inc., for several billion dollars, people familiar with the matter said Tuesday.If the deal goes through, it would be one of NTT’s largest overseas investments in recent years. The company, whose operations span fixed-line and mobile..."
How to Pick Your Child’s First Computer,"May 10, 2016 12:34 p.m. ET","It's Time to Give Your Child a ComputerAt which age should your children get their own computers? WSJ's Wilson Rothman weighs what matters when parents face that major question. Photo/Video: Emily Prapuolenis/The Wall Street JournalBy Wilson RothmanMay 10, 2016 12:34 p.m. ET32 COMMENTSWhen children first learn to speak, it’s precious. Soon, you can’t shut them up. When they first hop on your computer, pecking at the keyboard and scooting the cursor around with the mouse or trackpad, you exclaim, “They’re so smart!” But after weeks of them hogging your work-issued laptop to print Pokémon coloring pages or Google cats, you wonder if it’s time for a family computer.That’s the story in my house, and a variation on the theme that emerged when I spoke to families and educators around the country. My virtual focus group of 50 parents—all with children of elementary- or middle-school age—proved that the family computer is alive and well. For this crowd, price, durability, safety and battery life were top priorities. But navigating so many new choices can be a challenge.I set out asking a simple question: At what age should children get their own computer?In first or second grade, children start regularly using computers in school. It makes sense for children that age to have access to a computer for learning games and other safe activities. But it shouldn’t belong to your child—it’s a family resource that requires supervision. Even if you’re not worried about them searching for trouble, parents know that even the most saintly YouTube clip can have related videos of a more devilish nature.“Hold off on an individual computer as long as you can,” says Garrett Fogel, a first-grade teacher at Green Elementary School in my town of Dublin, Calif., who has taught nearly every grade from first through eighth and has two boys of his own. “The family computer is usually in a room where parents can monitor it. That’s best for smaller kids,” he says.THE DESKTOPPROS: More power for less money; central, fixed location means lower chances of goofing off; big screen great for work and play. CONS: Requires home real estate you may not have; not easily stowed when you want it gone.PHOTO: MIKE SUDAL/THE WALL STREET JOURNALBy fourth grade, many students are doing quite a bit of computer work at school, and it snowballs from there.“High school is where it becomes more of an issue,” says James Steyer, chief executive of Common Sense Media, a nonprofit advocacy group that promotes safe uses of technology for children and families. “You can see why they want access to their own computer because of the homework factor. But they’re also playing games, so you want to find the balance.”The traditional family PC was a desktop system, permanently fixed in a central location. It’s never been a more cost-effective option. There are towers for $400 to $600 that you can pair with a monitor. As you climb up above $1,000, you also have some slicker all-in-one options, such as an iMac or one of HP ’s Envy touch-screen PCs.Despite the supervisory advantages of a desktop, however, I found that parents increasingly are interested in a computer they can put away. The Windows world has more affordable laptops than Apple’s popular MacBooks. Dell’s Inspiron 11 3000 Series—configured with a touch screen, a Core i3 chip and 128GB of solid-state storage—costs $600. It’s a nicer, sturdier pick than Microsoft ’s own heavily marketed Surface tablet, which starts at $500 without the $130 keyboard.Beware anything below that price and avoid anything without an Intel Co re processor: Truly cheap Windows laptops will leave you frustrated. Even on Microsoft’s own new Windows 10 Edge browser, pages are painfully slow to load.THE HAND-ME-DOWNPROS: Won’t cost you anything; already has software; you already know how to use it. CONS: OS needs to be kept up-to-date; may need RAM or hard-drive upgrades; keyboard, battery, etc. could be past their prime.PHOTO: MIKE SUDAL/THE WALL STREET JOURNALMacBooks, which sell new at $900 or more, most often came up as ideal hand-me-downs. That shiny laptop you bought five years ago may have lost its luster, but most children won’t notice.If you are going to hand over an old Mac or Windows PC, make sure its software is up-to-date. Parental controls are better on the most recent operating systems. So are safety measures that protect computers from phishing and other threats that could afflict children and adults alike. Free software called CloudReady can also help turbocharge a computer that’s past its prime.In some cases, a hand-me-down could benefit from a RAM memory upgrade or a new storage drive. If you swap in a solid-state drive, you could cut your old computer’s boot time in half and speed up a lot of other interactions, too. Worst-case scenario: You have to take the computer in for a new battery.A trickier question: Does the iPad, which may have been a part of a child’s life from a far earlier age, count as a computer? The answer is yes, but given its price it may well not be the one best suited to your needs.Parents and teachers of younger children like iPads because they’re so intuitive to use. Their processing power has, in recent years, become vast. And if a child has to lug a computer around, there’s no lighter option.THE IPADPROS: Versatile for desk work and creative projects; intuitive to children; apps and Web cover most software needs. CONS: Small screen, low storage for high price; can’t teach traditional keyboard-and-mouse computing.PHOTO: MIKE SUDAL/THE WALL STREET JOURNALThe combination of Web browser and app store ensures that children can do most or all of the activities they can do on any other computer, and a bunch of things they can’t do with other devices, such as shoot and edit a movie. Apple’s new iPad Pro models even support a pen that’s great for visual arts.The catch is that all of this comes at a significant cost: A 32GB iPad Pro with keyboard case costs about $750. A cheaper alternative—the iPad Air 2 with a Logitech keyboard case—comes in around $500, but that’s before you pay $100 to bump the unforgivably paltry 16GB of internal storage up to 64GB. And in both scenarios, the screen is just 9.7 inches, and the keyboards aren't very good. (The 12.9-inch iPad Pro with keyboard case costs nearly $1,000.)Kara Larcome, a mother of two and the science, technology, engineering and math curriculum coordinator for North Andover Public Schools in Massachusetts, says that, as she prepares to buy a first family computer, she’s leaning in another direction.Her children are comfortable around iPads, but she wants her 5-year-old to learn to use a trackpad, and to type on a physical keyboard. Since she and her husband already have computers, an inexpensive Chromebook—which runs Google’s Chrome OS and is designed almost entirely around Web browsing—is the most justifiable purchase.One reason Chromebooks have taken off is that many schools are choosing Web-based workbooks and reading modules, say the educators I spoke with.THE CHROMEBOOKPROS: Best performance, biggest screens for lowest price; simple Web interface with supervised controls. CONS: Lacks software, including the popular Minecraft; children with certain interests could outgrow it.PHOTO: MIKE SUDAL/THE WALL STREET JOURNALWhen using Chromebooks with children, you create supervised accounts and monitor what children do online via a dashboard. You can also ban sites by name, or list only the sites you want your child to visit. The tool is rudimentary—there’s no switch to flip that automatically eliminates the nastiest of the Web, for instance—but it can be handy.A new Acer Chromebook 14, with a 14-inch screen and, according to its maker, 12 hours of battery life, is made with sturdy, lightweight aluminum and packs enough power for smooth Web work. It sells for $300.A Chromebook still can’t run some very common software. Minecraft, the insanely popular construction-and-adventure game, is now also a classroom tool. Chromebook’s inability to access it came up as a deal breaker for several families I spoke to.But Ms. Larcome, who has a work-issued MacBook Air, says even she would use a Chromebook at home. “None of the features I would need are missing.”She’ll have to be careful, though. If she starts using it too much, her daughter may have to ask her to kindly find her own computer.Write to Wilson Rothman at Wilson.Rothman@wsj.com or on Twitter @wjrothmanAppeared in the May 11, 2016, print edition as 'The Smart Way to Pick Your Child’s First Computer.'"
