title,date,body
Joel Greenblatt Dividend Stocks In Focus: Seagate Technology,Apr. 4.17,"This post was written by Bob Ciura for Sure DividendSeagate (NASDAQ:STX) is a rarity in the technology sector. Based on its recent share price, the stock offers a 5.5% dividend yield. Such a high dividend yield is usually reserved for utility stocks.Seagate has a volatile dividend history. It is not on the list of Dividend Achievers, a group of 271 stocks with 10+ years of consecutive dividend increases. You can see the full Dividend Achievers List here. But, its high yield has attracted the attention of Joel Greenblatt, Managing Principal and Co-Chief Investment Officer of Gotham Asset Management. Seagate is one of the top 20 dividend stocks in Joel Greenblatt's portfolio.Gotham owns approximately 546,000 shares of Seagate, an investment worth roughly $21 million.Seagate has a very high dividend yield, which is normally a 'red flag' that the company is in trouble.While Seagate is in a turnaround phase, it continues to generate enough cash flow to maintain its hefty dividend payout.This article will analyze Seagate and its dividend.Business OverviewSeagate provides data storage products, mainly hard disk drives, which account for 90% of the company's revenue by product line.Seagate had a difficult year in 2016. Revenue declined 19% for the year. The decline in revenue was due to three factors, which were the strong U.S. dollar, weaker economic conditions in China, and the troubles facing the personal computer segment.Seagate has a large international footprint, with the majority of its revenue coming from outside the U.S. Its revenue breakdown by geography is below:Americas (29% of annual revenue)Europe, Middle East, and Africa (17% of annual revenue)Asia-Pacific (54% of annual revenue)More than half Seagate's annual revenue comes from Asia, meaning the slowdown in the Chinese economy last year hit the company particularly hard. And, the steady decline in global PC shipments has caused related storage devices to decline in tandem.The smartphone boom has shown no signs of slowing down. As more computing functions are performed on smartphones, there is less demand for laptop and desktop computers. Technology industry research firm Gartner found that 2016 marked the 5th consecutive year that global PC shipments fell. For the year 2016, PC shipments declined 6.2% from 2015. PC client shipments continue to represent 24% of Seagate's HDD revenue. That said, the company still generated more than $11 billion of revenue last year."
Seagate Technology's (STX) CEO Steve Luczo on Q2 2017 Results - Earnings Call Transcript,Jan.24.17,"Seagate Technology (NASDAQ:STX) Q2 2017 Earnings Conference Call January 24, 2017 5:00 PM ETExecutivesKate Scolnick - Senior Vice President of Finance, Corporate Communications and TreasurySteve Luczo - Chairman and Chief Executive OfficerDavid Morton - Executive Vice President and Chief Financial OfficerDave Mosley - President and Chief Operating OfficerAnalystsRichard Kugele - Needham & Company, Inc.Ananda Baruah - Brean Murray Carret & Co., LLCSherri Scribner - Deutsche BankAmit Daryanani - RBC Capital MarketsOperatorGood morning and welcome to the Seagate Technology Fiscal Second Quarter 2017 Fiscal Results Financial Results Conference Call. My name is Carmen and I will be your coordinator for today. At this time, all participants are in a listen-only mode. Following the prepared remarks, there will be a question-and-answer session. As a reminder, this conference is being recorded for replay purposes.At this time, I would like to turn the call over to Kate Scolnick, Senior Vice President Investor Relations and Treasury. Please proceed, Kate.Kate ScolnickThank you. Good afternoon, everyone, and welcome to today’s call.Joining me today from Seagate’s executive team are Steve Luczo, Chairman and CEO; Dave Morton, Executive Vice President and CFO; Dave Mosley, President and COO; and Phil Brace, President of Cloud Systems and Silicon Group.We’ve posted our press release and detailed supplemental information for second fiscal quarter fiscal year 2017 on our Investor Relations site at seagate.com. During today’s call, we will review the highlights for the December quarter and provide the company outlook for the third fiscal quarter of fiscal year 2017, and then open the call for questions.We are planning for the call today to go approximately half-an-hour and we will do our best to accommodate your questions following our prepared remarks as time permits. We will refer to GAAP and non-GAAP measures on this call. Non-GAAP figures are reconciled to GAAP figures on our supplemental information available on the investor section of our website. We’ve not reconciled our non-GAAP financial measures guidance to the most directly comparable GAAP measures because material items that impact these measures are out of our control and/or cannot be reasonably predicted. Accordingly, a reconciliation of the non-GAAP financial measure guidance to the corresponding GAAP measures is not available without unreasonable effort.As a reminder, this conference call contains forward-looking statements about the company’s anticipated future operating and financial performance, customer demand, technology and product development advancements, and general market conditions. These forward-looking statements are based on management’s current views and assumptions and should not be relied upon as of any subsequent date. Actual results may vary materially from today’s statements.Information concerning our risks, uncertainties and other factors that could cause results to differ from these forward-looking statements are contained in the company’s SEC filings and supplemental information posted on the investor section of the company’s website at seagate.com.I would now like to turn the call over to Steve Luczo. Please go ahead, Steve.Steve LuczoThanks, Kate. Good afternoon, everyone, and thanks for joining us today. For today’s call, I will cover the high-level trends we are seeing in the business, Dave Morton will then discuss certain financial highlights, and I’ll close the call with our outlook for the March quarter, as well as for the calendar year 2017.Over the course of calendar 2016, Seagate exhibited discipline and focus and delivered four consecutive quarters of gross margin, operating margin, and EPS improvements. The drivers of our improving performance, particularly in the December quarter are combination of market demand trends across our high capacity storage solution portfolio, component cost optimization within our storage products, and the structural cost improvements we are driving throughout our company, particularly within our manufacturing operations."
"Seagate -16% after earnings, conservative guidance","Apr. 26, 2017 2:38 PM ET","Seagate (STX -16.2%) shares have tanked today and are still drifting lower in the afternoon, in the wake of a revenue miss in today's fiscal Q3 earnings that also featured downside guidance.Shares had hit a 52-week high yesterday.Gross margin was 30.5% (31.4% on a non-GAAP basis), and the company is projecting 31% for the current quarter.Results reflect a ""stable demand environment, good operational execution and momentum in the stabilization of our business model,” says Chairman/CEO Steve Luczo, but notes ""cautious optimism"" looking ahead.He's forecasting revenues of $2.5B-$2.6B (vs. $2.56B consensus), pointing to seasonal declines, a wish to hold smaller inventory going into summer, and ""some conservatism due to the potential impact of component shortages in DRAM and NAND on various aspects of our customers' businesses in the server, CSP and client space.""Overall exabyte demand should grow double digits in calendar 2017, representing ""modest"" revenue growth opportunities. He still sees EPS of $4.50 for calendar 2017 (below consensus for $4.59).Earnings call transcriptPress ReleaseNow read: Smartphones Drive New Global Tech Cycle, But Is Demand Peaking?"
Seagate Technology Plc (STX) Q3 2017 Results - Earnings Call Transcript,Apr.26.17,"Seagate Technology Plc (NASDAQ:STX) Q3 2017 Earnings Call April 26, 2017 9:00 AM ETExecutivesKate Scolnick - Seagate Technology PlcStephen James Luczo - Seagate Technology PlcDavid H. Morton, Jr. - Seagate Technology PlcWilliam David Mosley, Ph.D. - Seagate Technology PlcPhilip G. Brace - Seagate Technology PlcAnalystsJoe H. Wittine - Longbow Research LLCEdward Parker - BTIG LLCRich J. Kugele - Needham & Co. LLCRobert Cihra - Guggenheim Securities LLCOperatorGood morning. And welcome to the Seagate Technology Fiscal Third Quarter 2017 Financial Results Conference Call. My name is Liz and I will be your coordinator for today. At this time, all participate are in a listen-only mode. Following the prepared remarks, there will be a question-and-answer session. As a reminder, this conference is being recorded for replay purposes.At this time, I would like to turn the call over it to Kate Scolnick, Senior Vice President, Investor Relations and Treasury. Please proceed, Kate.Kate Scolnick - Seagate Technology PlcThank you. Good morning, everyone, and welcome to today's call. Joining me today from Seagate's executive team are Steve Luczo, Chairman and CEO; Dave Morton, Executive Vice President and CFO; Dave Mosley, President and COO; and Phil Brace, President of Cloud Systems and Silicon Group. We've posted our press release and detailed supplemental information for our March quarter of fiscal 2017 on our Investor Relations site at Seagate.com.For the last few years, we have communicated our belief that data growths trends will continue to drive storage exabyte demand and the related measurement of capacity per drive and that units are less relevant to mobile cloud environments and future client addressable markets.In today's newly deployed architectures and applications, high-capacity mass storage is critical. Importantly for Seagate, it is the advanced technology and heads of media, as well as manufacturing absorption of these technologies and test capacity absorption that will most significantly impact our financial performance.Going forward, we will continue orienting our conference call remarks and supplemental data to key market exabyte results and other business metrics and discontinue providing unit detail. We recognize this represents a change for the investment community in the short term, but believe it better reflects how we are managing and measuring our business performance internally and will help our industry to be evaluated more effectively in a forward-looking manner.During today's call, we will review the highlights for the March quarter and provide the company outlook for the June quarter and then open the call for questions. We are planning for the call today to go approximately half an hour, and we will do our best to accommodate your questions following our prepared remarks, as time permits.We will refer to GAAP and non-GAAP measures on this call. Non-GAAP figures are reconciled to GAAP figures on our supplemental information available on the Investor section of our website. We have not reconciled our non-GAAP financial measure guidance to the most directly comparable GAAP measures because material items that impact these measures are out of our control and/or cannot be reasonably predicted. Accordingly, a reconciliation of the non-GAAP financial measure guidance to the corresponding GAAP measures is not available without unreasonable effort.As a reminder, this conference call contains forward-looking statements about the company's anticipated future operating and financial performance, customer demand, technology and product development advancements and general market conditions. These forward-looking statements are based on management's current views and assumptions and should not be relied upon as of any subsequent date. Actual results may vary materially from today's statements. Information concerning our risks, uncertainties and other factors that could cause results to differ from these forward-looking statements are contained in the company's SEC filings and supplemental information posted on the Investor section of the company's website."
My Proposed 14% Income Yield Trade With Seagate,Jan.10.17,"I am worried about the over-valuation of the market. I am concerned about the potential compression of dividend stocks as interest rates climb. At the same time, I cannot recommend sitting on the sidelines since the market could keep grinding upwards for years to come - albeit at a slower pace.So what is an investor supposed to do when the market is offering a large plate of blah?My recommended play for 2017 is to either sell cash-secured put options or deep in-the-money covered call options. These have the same basic effect on your account. First, I will talk about the basic process of this trade and then I will focus on performing this trade with Seagate (NASDAQ:STX).Covered Calls vs. In-The-Money Put SellingA covered call is where you own the underlying (shares) but sell rights on them.For example, you own shares at $100 apiece and you sell the rights with a strike price at $75 per share. You collect a premium for selling this contract. You do not participate in any upside gain but you also do not incur any losses until prices hit $75 per share. Your return is based on dividends (yes, you still collect the full dividend on the stock) plus the options premium.Selling a cash-secured put means you put cash in your account and make an agreement to buy shares should they fall to a certain price.Assume the stock is at $100 per share and you are willing to purchase shares at $75 apiece. You collect a premium for this contract. You do not participate in any upside move of the stock - because you don't own it. You do not collect dividends. You are obligated to own shares at $75 apiece if the contract is exercised, so you incur losses below this level. The options premium will typically include value of the dividend - although you don't actually receive one."
Seagate Technology: High Yield Dividend Income Or Value Trap?,Apr.19.17,"Many of the most popular high yield stocks are real estate investment trusts (REITs), master limited partnership (MLPs), and business development companies (BDCs). All of these industries are designed to pay very high dividends.When it comes to regular corporations, however, a very high dividend yield can be a warning sign that something is fundamentally flawed with the company's business model.Many of these companies tend to have relatively low Dividend Safety Scores, indicating that their dividends could be at risk of being cut in the future.Let's take a closer look at Seagate Technology (NASDAQ:STX), which offers a high dividend yield above 5% and has paid higher dividends for six straight years, to see if the stock could be appropriate for our Conservative Retirees dividend portfolio.Business OverviewFounded in 1978 in Dublin, Ireland, Seagate Technology is one of the world's largest suppliers of data storage hardware, including hard drives, solid-state hybrid drives, solid-state flash-based drives, and memory cards.The company's products are found in everything, from PCs, mobile phones, tablets, and digital video recorders (DVRs) to cloud computing servers.However, Seagate's fortunes continued to be tied to its specialty, hard disk drives (HDDs), which is the industry it helped pioneer. HDDs are devices that store digital information on rotating disks with magnetic surfaces. They have been used in a number electronic devices, such as PCs, for decades.Business AnalysisUp until recently, Seagate was flying high on the boom in demand for data storage devices.While that demand continues to grow rampantly, the company is facing major challenges in growing its top and bottom line on two fronts."
"Seagate Tries Less Production, More Tech Sharing In China Retrench",Jan.12.17,"New reports are saying that hard disk drive maker Seagate (NASDAQ:STX) is closing down a factory in the eastern city of Suzhou as part of a restructuring plan to revive its operations. Such a development isn't huge news, since the global semiconductor sector is undergoing a major consolidation.But this particular closure also comes just months after Seagate announced a new tie-up with Chinese partner Sugon to tap the local market for IT products and services. So the bigger question becomes: What's the meaning of this factory closure and the newer joint venture, and what's the outlook for semiconductor and high-tech equipment manufacturing in China?The answer seems to be that China is losing its attractiveness as a manufacturing ground for high-tech products partly due to a massive campaign by Beijing to build up a globally competitive domestic chip sector. At the same time, selling IT products services into China is still a lucrative area for foreign makers of chips and networking equipment. But they can only do that now in partnership with Chinese firms, following Beijing's recent roll-out of a tough new national security law.We'll look more closely at the bigger picture shortly and what it might mean for big foreign tech names in China, but first let's review the basic facts surrounding Seagate. The company is saying it will cut 2,000 jobs as a result of closing its Suzhou factory, which is part of a previously announced broader global restructuring plan (English article)."
"Seagate Technology beats by $0.03, misses on revenue","Apr. 26, 2017 8:03 AM ET",Seagate Technology (NASDAQ:STX): Q3 EPS of $1.10 beats by $0.03.Revenue of $2.67B (+3.1% Y/Y) misses by $40M.Shares -1.5% PM.Press ReleaseSee more on FinTech Thematic ETFs »
"Seagate Technology +13.6%, Western Digital +6.5% after hours","Jan. 24, 2017 6:07 PM ET","Amid Seagate Technology's strong Q2 2017 reporting, accompanying conference call and issuance of above-consensus Q3 (revenue approximately $2.7B; consensus $2.62B) and FY 2017 (EPS ""at least"" $4.50; consensus $3.77) guidance.Western Digital (NYSE:WDC) closed today's market session higher by 4.62% and Seagate Technology (NASDAQ:STX) by 2.92% on various other positive industry indicators.Western Digital reports its 2016 December-ended quarter tomorrow.Visit Seeking Alpha's Premium ETF Screener, the best ETF research tool for your portfolio"
What We Learned About Micron Technology From Main Competitor Samsung Electronics,Jan.15.17,"Micron Technology (NASDAQ:MU) announced its Q1 2017 earnings on December 21, 2016, reporting that revenues increased 23% for the first quarter of fiscal 2017 compared to the fourth quarter of fiscal 2016. This growth was attributed primarily to 18% and 26% increases in DRAM and trade NAND sales volumes, respectively, and a 5% increase in DRAM average selling prices.While that sounds good, it's difficult to compare results without a reference, particularly since MU's fiscal quarter ended on December 1, 2016 and those of main competitors Samsung Electronics and SK Hynix end on December 31, 2016 and have yet to report at the time of this writing.Fortunately, Samsung Electronics (OTC:SSNLF) gave us a preview of its Q4 2016 earnings report, and we can use it as a metric to determine MU's competitiveness in these extraordinary times when it seems like stock prices are running parallel to memory ASPs.Samsung's semiconductor revenues are expected to increase 19% in Q4, due primarily to a 13% and 28% increase in DRAM and NAND sales volumes, respectively, and an 8% increase in DRAM average selling prices.The table below presents a comparison of the two companiesComparison of Micron Technology and Samsung Electronics - Percentage ChangesMicron TechnologySamsung ElectronicsDRAM Sales (revenue)24%12.6%Gb Sold18%1.9%ASP (per Gb)5%ASP ($)7.7%NAND Sales (revenue)26%28.0%Gb Sold26%15.5%ASP (per Gb)0%ASP ($)8.0%"
Western Digital's Future Business Depends On Toshiba's NAND Spin-Off Decision,Jan.23.17,"Toshiba (OTCPK:TOSYY) disclosed that it will likely sell a roughly 20% interest in its semiconductor unit for between 200 billion yen and 300 billion yen ($1.77-2.65 billion), while retaining a majority stake and keeping the new company in group earnings. Its semiconductor unit is largely NAND flash memory production.One possible idea being floated as part of the spin-off plan is a partial sale to Western Digital Corp. (NYSE:WDC).As a backdrop to this article, Toshiba and Western Digital operate key flash memory plants together in the Mie Prefecture city of Yokkaichi. Memory chips accounted for the majority of the 1.57 trillion yen in sales of Toshiba's semiconductor operations in fiscal 2015.Toshiba invented both NOR and NAND memory, and first established the flash memory market in 1984. SanDisk had been a long-term partner of Toshiba since 2001, and the joint venture had provided SanDisk with stable NAND supply. The two companies collaborated in developing BiCS3, which they claim was ""the world's first 3D NAND technology with 64 layers,"" up from 48 layers in the previous BiCS2 tech. The technology is now in production, with commercial volumes of BiCS3 expected to become available by mid-2017.Western Digital in 2016 acquired SanDisk for $19 billion, assuming all contractual agreements between Toshiba and SanDisk.Table 1Demand (Million Gb)20152016% Change2017% ChangeMobile23,82530,58528.4%38,38625.5%SSD33,49762,47686.5%113,59181.8%USB/flash21,77028,89232.7%33,76716.9%Other9,88411,68018.2%14,69725.8%Total88,976133,63350.2%200,44150.0%Supply (Million Gb)20152016% Change2017% ChangeSK Hynix (OTC:HXSCF)10,71016,00149.4%22,70041.9%Samsung (OTC:SSNLF)31,84453,99069.5%82,48052.8%Toshiba40,47047,43517.2%63,16033.2%Intel (NASDAQ:INTC)/Micron (NASDAQ:MU)5,87820,119242.3%28,24840.4%Other7466-10.8%9543.9%Total88,976137,61154.7%196,68342.9%"
Western Digital Is A Way To Benefit From Data Storage Demand Growth,Feb.27.17,"Company DescriptionWestern Digital (NYSE:WDC) is a digital storage company with a product suite that includes hard disk drives (HDDs), solid-state drives (SSDs), NAND flash memory, hybrid storage products and systems, and storage-enabling software. In its current form, WDC is the amalgamation of three major companies that have combined over time - the legacy Western Digital business (HDDs), Hitachi Global Storage Technologies, or HGST (HDDs, acquired in 2012), and SanDisk (SSDs and NAND flash, acquired in 2016). WDC is the only digital storage company with fully integrated HDD, SSD, and NAND flash capabilities. The HDD industry is a near-duopoly. WDC and Seagate (NASDAQ:STX) each have +/- ~45% market share, with Toshiba (TSSBY) accounting for the remainder. In NAND, WDC/SanDisk controls ~40% of wafer capacity.Variant PerceptionWDC's margins will continue to expand over the next several years, faster than the market is projecting, as the company extracts synergies from HGST and SanDisk and storage supply (HDDs and NAND flash memory) remains constrained relative to demand growth. The market's skepticism over WDC's top line growth model of 4-8%/year will prove unwarranted, with data center data demand growing ~40% year and strong end market opportunities across its product suite. This will result in valuation re-rating on top of earnings growth."
"Western Digital: Not A Bargain Right Now, But A Sound Investment",May. 1.17,"A few days ago Mark Bern published a very informative article about Western Digital Corporation (NYSE: WDC) and raised the question if the company is “an investment or a speculation?” As result of different concerns regarding WDC the author ended the article with the conclusion that the stock is rather speculative. Although I won’t recommend buying Western Digital at current price levels, I'm pretty pleased with my investment so far and will explain why I'm rather bullish than bearish on the stock although there might be some issues with the company. We will look at the future potential of data storage, we will look at the development of revenue and net income and end the article with an intrinsic value calculation. But we will start the discussion by looking at the most worrisome aspect – the high debt levels.The debt: Rather concerningFor many years Western Digital had almost no debt (and hence a very low D/E), but on May 12, 2016, the acquisition of SanDisk was officially completed and in order to finance the transaction WDC took on several billions in debt. On December 30, 2016, the total debt was $13,299 million. Six months earlier the total debt was about $17.5 billion and therefore WDC already managed to reduce the outstanding debt by $4.2 billion (but had to reduce the cash and cash equivalents from $8,151 million to $4,940 million). Most of the outstanding debt needs to be paid back in the years between 2020 and 2024. The D/E ratio of 1.24 can give us a first hint - that the debt levels are not extreme, but can be a burden for the company."
