title,date,body
Hutchinson Technology: Misinformation About TDK Walk-Away Date Creates A Buying Opportunity,May.11.16,"Last week, a negative article was written about Hutchinson Technologies (NASDAQ:HTCH) transaction to be acquired by TDK (OTCPK:TTDKY) for to $4.00 per share by arbjournal.com. I can't link to the article because its subscription only, but the basis of the negative article this time is that the walk-away date for TDK to pull away from the deal is May 2nd, 2016. Although this date was originally true, if one reads the detail of definitive merger agreement (DMA) you would learn that the TDK walk-away date is now November of 2016 since only FTC approval remains. Basically, the agreement says that if only FTC or CFIUS approval remains, then the walk-away date for TKD extends to November of 2016. HTCH already has CFIUS approval, so now only FTC approval remains. Please see page 67, section 11.03 (a) for confirmation. If you want further confirmation, I am sure HTCH's investor relations contact can confirm it for you. I wish the arbjournal.com blogger would have done this prior to putting out two misleading blogs in a row.Another factor that gives us confidence in receiving $4 per share in cash is that HTCH reported their Q1 earnings on April 27 an Industry giants Seagate (NASDAQ:STX) and Western Digital (NYSE:WDC) support the deal, we see no reason approval won't occur and they reiterated their belief that they expected the deal to close no later than the second quarter of 2016. This management team is very conservative and if they had any doubts that the timing of the deal was slipping, this was their opportunity to tell investors. Rather, they confirmed the timeline and their previous guidance. Plus, HTCH had 47.9 million in cash at quarter end, so they are well above the required $35 million to get the full $4.00 per share."
5 Undervalued Companies For Value Investors With A High Beta - January 2016,"Jan. 31, 2016 3:33 AM ET","There are a number of great companies in the market today. By using the ModernGraham Valuation Model, I've selected the five undervalued companies for value investors reviewed by ModernGraham with the highest beta.A company's beta indicates the correlation at which its price moves in relation to the market. A beta greater than 1 indicates a company is more volatile than the market.Each company has been determined to be suitable for either the Defensive Investor or the Enterprising Investor according to the ModernGraham approach. Defensive Investors are defined as investors who are not able or willing to do substantial research into individual investments, and therefore need to select only the companies that present the least amount of risk. Enterprising Investors, on the other hand, are able to do substantial research and can select companies that present a moderate (though still low) amount of risk.With a high beta, Mr. Market may turn these companies around very quickly, so be sure to check them out in depth!Seagate Technology PLC (NASDAQ:STX)Seagate Technology PLC qualifies for the Enterprising Investor but not the more conservative Defensive Investor. The Defensive Investor is concerned with the insufficient earnings growth or stability over the last ten years, the low current ratio, and the inconsistent dividend record. The Enterprising Investor is only initially concerned by the level of debt relative to the net current assets. As a result, all Enterprising Investors following the ModernGraham approach based on Benjamin Graham's methods should feel comfortable proceeding with further research into the company.As for a valuation, the company appears to be undervalued after growing its EPSmg (normalized earnings) from $2.39 in 2012 to an estimated $4.14 for 2016. This level of demonstrated earnings growth outpaces the market's implied estimate of 0.9% annual earnings loss over the next 7-10 years. As a result, the ModernGraham valuation model, based on Benjamin Graham's formula, returns an estimate of intrinsic value above the price. (See the full valuation)"
Western Digital: Time To Be Optimistic,May.13.16,"Western Digital (NYSE:WDC)-the leading Hard Disk Drive (HDD) maker-has been feeling the pressure in the past 12 months due to an accelerated decline in PC sales and increased adoption of Solid State Drive (SSD). Last year, the company acquired SanDisk, an SSD maker, to diversify its business. The market thought that Western Digital paid an unjustifiably high price for SanDisk at a time when the competition in the SSD market was heating up due to 3-D NAND technology. The company's stock price declined from $100 to $37. However, this acquisition has the potential to fundamentally change the risk profile of WDC in the impending technology shift. Despite short-term headwinds, the storage market will grow in the long term and Western Digital is best positioned to benefit.Investment ThesisBefore acquisition, a dominant player in a declining HDD marketThe HDD market came a long way via consolidation to reach the state of trioploy in 2012. Western Digital (43%), Seagate (NASDAQ:STX) (42%), and Toshiba (15%) have since maintained a balanced market and earned decent returns. During this period, Western Digital achieved a 28%/22% Gross/EBITDA margin and maintained an average ROIC of 14%. However, nothing is static in technology, especially for commoditized hardware. The emergence of SSD has slowly intruded into the HDD market. The development of 3-D NAND may further lower the cost of SSD and break the balance in the HDD trioploy.An underestimated acquisition that changed the competitive landscapeAlthough the acquisition of SanDisk may appear to be expensive, it completely changed Western Digital's risk profile. Of the three storage technologies, the new Western Digital's products are the leaders in HDD and planar SSD. The company is also fighting in the new 3-D NAND development. Before the acquisition, there was a risk that the success of 3-D NAND would permanently shrink Western Digital's addressable market. Now, however, Western Digital's technology portfolio ensures that it can prosper under all scenarios. Moreover, Toshiba's small share in the HDD market and joint venture with SanDisk will provide it with an incentive to improve its cooperation with Western Digital and this will put pressure on pure players like Seagate."
"Micron, Intel And 3D NAND Post 2016 - Is That All There Is?",Feb.29.16,"Is that all there is?Is that all there is?If that's all there is my friendsThen let's keep dancingLet's break out the booze and have a ballIf that's all there is.- Jerry Leiber and Mike StollerFY 2016 will be disappointing for Micron (NASDAQ:MU) investors with the DRAM business experiencing what is shaping up to be unrelenting weak market demand. When that is coupled with continuing oversupply pressures, this time from Micron rather than Samsung (OTC:SSNLF), the result is unlikely to be positive. Our last article concluded that there was little to be expected from the NAND business either - for Micron at any rate.Intel (NASDAQ:INTC) will be a far different story. The company won't be seeing a lot of volume from the Micron Fab 10X expansion and its own Dalian plant, but what volume it does get it'll get top dollar for in the enterprise/data center market that it dominates. It has the NVMe controller expertise to capitalize on as it brings to market a new series of TLC-based 3D NAND SSDs in the back half of 2016 that will likely set new records for throughput, endurance, and latency in the most demanding applications.Micron will achieve some success with partners like Seagate (NASDAQ:STX) and IBM (NYSE:IBM) bringing SAS-based SSDs into more conservative and cost-sensitive enterprise environments, so that's worth something, but whether or not they can successfully market their own branded SSD product (from the Seagate partnership) is still to be proven. Whatever their limited success this year, the key to the great game of NAND is 2017 and beyond through the balance of the decade. It is to that topic that we now turn.In our last article, we opined that it is likely that the IM partners will have a quantifiable cost advantage with their floating gate-based 3D NAND design by late this year. Despite Samsung holding almost a 19% density advantage with its 256Gb 48L TLC product, it has not been shy about positioning its technology aggressively. The central claim has been most vociferously voiced by Intel - to wit, the technology will scale on a Moore's Law basis, doubling the bits every two years. Micron is also very bullish. Listen to Micron's VP of Technology, Scott DeBoer, at the 2015 Summer Analysts Conference:"
It's Only Embarrassing If You Try To Avoid Embarrassment,"Apr. 24, 2016 3:27 PM ET","Most of us can recall a time when we were embarrassed, unless your need for denial is stronger than your memory.It's probably much worse when there are a lot of people around as witnesses.It may be even worse if your antics are under embargo, finally being released at 2 PM, say on a Wednesday, and then really called into question the following day with the planned release of the GDP.There's nothing like being under the spotlight, especially when purposefully bringing attention to yourself and then somehow messing up.I imagine, that even as poised and calm as she appears as the Chairman of the Federal Reserve, a young Janet Yellen may have been as easily subject to embarrassment as a child as any of us.Obviously, I also imagine that the hairdo hasn't changed over the years.Of course, it could be really helpful to know what the actual GDP statistic will be and having your performance altered to meet the demands of reality.This coming week has an FOMC Statement release which is followed barely 20 hours later by news of the GDP for the first quarter of 2016.As the FOMC meeting gets underway on Tuesday, there is no doubt awareness of the consensus calling for lackluster GDP growth and the Atlanta Federal Reserve's own decreased estimate just a few weeks ago.One would think that with some strong sense of what the data really happens to be, the chances of embarrassing one's self by taking the opportunity to announce an interest rate increase at this coming week's FOMC meeting would be very small."
A Contrarian Take On The Hard Drive Debate,"Apr. 11, 2016 5:20 PM ET","I reached a milestone recently, having completed the backup of my data into the cloud. It took months to deliver the hundreds of gigabytes to the invisible (to me) data centers that comprise the cloud and it got me thinking about data storage - namely the future of HDDs and SSDs - and the manufacturers of storage technologies - primarily Western Digital Corp. (NASDAQ:WDC) and Seagate Technology (NASDAQ:STX).Hard drive makers Western Digital and Seagate have seen their stock prices crushed since the beginning of 2015: Western Digital is down about 60%, Seagate, about 50%. The purported reasons are many, from decreasing PC demand to the rise of solid state hard drives (SSDs). But it was my own experience with storage that got me to think about the HDD/SSD debate in a different light.For the record, I will refer to both HDDs and SSDs as hard drives, even though I'm pretty sure it is technically not a proper term for SSDs. To the true techies, I apologize in advance.Data, data everywhereRegardless of your loyalties in the HDD/SSD debate, I think we can all agree that data creation is expanding.According to IBM (NYSE:IBM), 2.5 quintillion bytes of data are generated every day. Quintillion is one of those multipliers that is so large that it loses all meaning. 2.5 quintillion bytes is 2.5 exabytes (another figure that has no meaning) or 2.5 million terabytes. Now we have reached a multiplier that I know: terabyte. 2.5 million of them is a lot."
Western Digital Stock Is A Contrarian Value Play,May. 4.16,"Western Digital Corporation (NASDAQ:WDC) has been feeling the heat as the hard disk drive (""HDD"") market continues to decline on weak PC demand. To combat this pressure, Western Digital made the decision to acquire flash memory manufacturer SanDisk (NASDAQ:SNDK) in order to diversify out of the HDD market and put itself in a position for some growth in the future.I recently wrote an article on Seagate Technology (NASDAQ:STX), which has decided not to reposition its business by making any significant moves. Instead Seagate has decided to tread water and hope for a rebound in HDDs. Not likely to happen. Western Digital's direction is much more promising for investors.(Source: WDC/SNDK Headquarters)There will be some significant growing pains from the SanDisk acquisition considering there are very few synergies between the two companies, but in the long run it was a move that Western Digital needed to make in order to survive. For investors with a short-term investing horizon, WDC is likely not a stock in which you want invest. HDD revenues will continue to decline and will be partially offset by SanDisk's contributions. The result of this mixing of different businesses will likely be a big ol' mess.As you may recall, when Western Digital initially announced its acquisition of SanDisk, many investors believed that the former was overpaying. However, there were really no other viable options available. It was either make an acquisition to pivot towards the SSD market or follow Seagate's path and pay dividends until the company goes underwater.For the sake of WDC investors, I'm glad the company chose to adapt instead of to die. A few years down the road, WDC will have a leveled-off, small HDD segment to serve the vestiges of the dying industry and a newfound focus on SSDs. If the transition is successful, WDC could have significant upside for long-term horizon investors.Over the course of that transition, investors will receive a nice 4.9% yield that Western Digital can still play handily for a while, unlike Seagate. And after the transition is complete, investors can look forward to a company that will be a big player in the SSD market; SanDisk is the third-largest flash memory manufacturer in the world.The SanDisk acquisition is expected to close in the second quarter as the deal is still awaiting Chinese regulatory approval. In all likelihood, the deal will go through and Western Digital will be a bit clunky as an organization for a while but will eventually come out as a company with potential upside and an avenue for growth.However, we must also weigh the risks here. In order to acquire SanDisk, Western Digital is issuing $14.1 billion in debt. This should not be a significant issue considering both Western Digital and SanDisk record plenty of free cash flow, but I will be watching the combined entity closely to see if management makes paying down the debt a top priority, which I hope they do.Regardless, there are still certainly quite a few risks involved in investing in WDC and risk-averse investors should likely look elsewhere for value. Long-term investors however might want to take a look at WDC after the SanDisk acquisition and determine if the upside potential outweighs the risks. I will be doing the same, and at this point in time I am leaning towards buying a small position after the acquisition closes.My question to you, the reader, is:What are your thoughts on WDC's acquisition of SanDisk? Was it the right idea, but the wrong move? Did they overpay? Was it the only move? Feel free to leave a one-word answer or a long-winded tirade in the comments section below.If you want to stay up-to-date on my articles, you can Follow me by going to my author page or by clicking ""Follow"" at the top of this page.Thanks for reading!"
A Shortage Of NAND Flash Memory Is Coming Soon - What Caused It And What Will Be Its Impact,May.16.16,"According to NAND flash controller and solution provider Phison Electronics chairman Khein-Seng Pua:There will be a shortage of NAND flash chips in the third quarter as most major vendors have not ramped up their 2D NAND flash chips over the past 18 months and their migration to the production of 3D parts has not been smooth.""According to Table 1 below, analysts from KDB Daewoo Securities forecast a shortfall of 5,032 million Gb in 2017:Table 1 - NAND Supply and Demandmillions Gb20142015Change%2016Change%2017Change%SEC21,29032,45052.4%46,00241.8%59,97330.4%Toshiba (OTCPK:TOSYY)/SanDisk (SNDK)25,45834,04033.7%47,43539.4%58,30222.9%Micron (NASDAQ:MU)11,04714,94435.3%20,11934.6%26,07529.6%SK Hynix (OTC:HXSCF)5,7898,89753.7%13,09547.2%16,76228.0%Other455420.0%6622.2%8731.8%Total Supply63,62990,38542.1%126,71740.2%161,19927.2%Smartphone/Tablet15,97122,66541.9%33,44647.6%45,26535.3%SSD23,01736,31457.8%51,42241.6%78,41852.5%USB/flash14,34416,52315.2%18,55412.3%20,1708.7%Other8,51511,64536.8%17,21447.8%22,37830.0%Total Demand61,84787,14740.9%120,63638.4%166,23137.8%Excess Supply1,7823,23881.7%6,08187.8%-5,032-182.7%If NAND supply and demand is analyzed on a month-to-month basis, the shortfall is anticipated to really kick-in in Q1 2017 with Q4 2016 almost at parity between supply and demand, as shown in Table 2 below:Table 2 - NAND Supply and Demandmillions Gb1Q20162Q20163Q20164Q2016SEC10,17711,26911,97912,578Toshiba/SanDisk10,63811,30712,43013,061Micron4,7384,9275,1255,330SK Hynix2,8033,1053,4233,765Other15161818Total Supply28,37130,62432,97534,752Smartphone/Tablet6,8907,5598,88310,114SSD11,17711,84813,85714,541USB/flash4,2774,5004,8284,949Other3,6093,8924,5915,121Total Demand25,95327,79932,15934,725Excess Supply2,4182,82581627"
Marvell Technology: Half Of It Is Cash.,May.13.16,"IntroductionMarvell Technology Group Ltd. (MRVL) (""Marvell"") is a hidden gem, an outstanding business possessing enormous cash inside, but having no debt. Starboard Value LP, the activist investor, bought a stake on February 2016 to make the company reconsider its capital allocation strategy. If this investor succeeds, the stock price should definitely increase.In this article, I will analyze the capital structure of Marvell as well as the value that could be unlocked for the shareholders.Business of Marvell TechnologyMarvell was incorporated in Bermuda in 1996. It is fabless semiconductor provider. It is worth mentioning here that we had a wave of M&As between this kind of companies a few months ago. I wrote several articles about this wave, maybe the most profitable was this one.The company sells mobile and wireless, storage, and networking devices. It sells its devices to a relatively small number of end customers, such as Western Digital, Seagate and Toshiba, and to a distributor namely Wintech. All these are big names in the industry.The R&D expenses are very important for this company. It expenses almost half of its total revenue in it. The company has been extremely successful in doing this, and the amount of intangible assets in the balance sheet is incredible. In the 10-K, the management talks about it like this:""As of January 31, 2015, we have been issued and/or have acquired over 5,300 U.S. patents and over 1,400 foreign patents with expiration dates ranging from 2015 to 2035. We also have more than 3,800 U.S. and foreign pending patent applications on various aspects of our technology.""Revenue, Cash Flow and EBITDASince 1996, the revenue has been growing quite a bit. As mentioned earlier, these people are doing a great job. In fiscal year 2015, the net revenue was $3.7 billion, 9% higher than that of 2014. They have been doing this for many years. To verify this factor, please have a look at the following chart:"
The Years Of Magical Thinking: The NAND Industry Confronts The Problem Of Demand Growth,Apr.20.16,"Magical thinking is a form of reasoning that learns causative relationships through correlation alone. Science and the scientific method are designed to elucidate causal relationships through careful controlled experiments; magical thinking, given a correlation with an observed effect, pulls a causation out of thin air.We look at the NAND business as a business that can have significant growth, but also has some interesting demand elasticity properties. - Mark Durcan - Credit Suisse Technology Conference Dec. 3, 2014... we think with 3D it will be the tipping point that will eventually allow the PC space to convert 100% to SSDs. - SA Transcripts, Micron's Ernie Maddock - Raymond James Technology Conference 2015In the last two articles, we have taken a hard look at the NAND business in 2016 and beyond. We have concluded that Micron (NASDAQ:MU) will see only a little benefit from the business in 2016, but can potentially harvest revenue and profit gains in 2017 and beyond if demand growth exceeds 35%. Intel (NASDAQ:INTC) is in much better shape because of its dominance of the data center. Because of that dominant position, Intel will likely see strong revenue and profit gains in 2016 and beyond into 2017 and 2018, assuming adequate demand growth. Depending on the overall market conditions, Intel is in a strong position to be the primary beneficiary of the innovative and cost-leading 3D NAND technology that the IM partners are now bringing to market.But what will those market conditions be? Questions regarding the economic viability of this new generation of 3D NAND product inevitably devolve to the question of demand. It would seem obvious that for a market aspiring to overall revenue and profit growth, demand growth must exceed the rise in productivity. In this case, if the capacity increases in the new 3D technology fall in the 35-40% per year range, overall market demand must exceed that level for there to be gross margin expansion."
Impacts From SanDisk/Western Digital Merger For Long-Term Value Investors,Mar.28.16,"This article was written by Bernardo Teixeira and Sam Frazier from the NU Student Value Fund.Over the years Western Digital (NASDAQ:WDC), along with many other computer driven storage companies, has suffered a huge HDD market drop due to the emerging trend of increased mobile based storage (NAND) and (SSD) as well as the increasing prevalence of wireless-based cloud storage. Because of these problems, Western Digital has seen its financial prospects drop significantly since December 2014. However, on March 15th, 2016 WDC stockholders approved a merger between Western Digital and SanDisk (NASDAQ:SNDK) for $18 billion with a shareholder approval rating of 90 percent. The terms of the buyout include $9 billion in term loans, $8 billion in bridge loans and $1 billion in credit. Western Digital has strategically bought SanDisk at a share price of $86.50 (with debt and long-term futures value added) in what we believe is a considerable discount to the future potential performance of the WDC/SNDK combined entity. By combining the financial statements of both companies and using conservative analyst expectations to forecast future cash flows of both companies, we have calculated that the combined entity currently trades at around 60% discount to its intrinsic price.Merger with SanDisk to unlock value in Chinese marketsThe major strategic value of the WDC/SNDK acquisition is that SanDisk has major influence in the East Asian market which has traditionally been hard for American storage and memory providers to compete profitably. Even though SanDisk holds only a 12% percent market share within the total flash memory and external hard drive markets, its value and technical ability exceeds that of its East Asian competitors. This acquisition will likely make Western Digital a powerhouse for storage needs that will now be able to meet both the Chinese and North American storage requirements. The main theory behind this acquisition is that Western Digital wants to compete with industrial chip makers such as Samsung (OTC:SSNLF), Micron (NASDAQ:MU) and Toshiba to provide cheaper NAND and SSD chips to the market place. Western Digital is likely to shape demand needs within East Asian consumers such as Apple and Samsung with high end mobile NAND storage and to possibly continue growth within emerging markets in South Asia and Southeast Asia, in countries such as Vietnam and India that have a growing mobile market."
Investing With An Edge: Hutchinson Technology,Feb. 1.16,"This is the latest in my ""Investing with an Edge"" series. For more on the series, please see here.Company: Hutchinson Technology (NASDAQ:HTCH). Reasons for opportunity: small size, complex deal, regulatory review.In November, Hutchinson announced a deal to be acquired by TDK (OTCPK:TTDKY). The deal structure is somewhat complex, and the merger received a request for further information from the FTC. The combination of those two factors has led shares to trade at a ~12% discount to the deal's most likely close price. Based on our analysis, we think the market is currently assigning ~20% chance that the deal breaks, but we think the true odds of the deal breaking is ~5% and the merger closes some time during the company's current time frame of late Q1 or early Q2 (so likely ~late April), resulting in an extremely attractive IRR for investors at today's prices.Let's start with an overview of the deal structure and then discuss the FTC risk. HTCH is getting acquired for $3.62 per share plus $0.0108 per share for every $500k of net cash over $17.5m HTCH has as of the last day of the fiscal month immediately preceding the merger close. This additional consideration is capped at $0.38 (or a net cash balance of ~$35m) for a max value of $4/share. Note that the cash is counted net of the company's revolver draw but ignores other debt.The obvious first question is: Will investors be paid this additional consideration? We believe the answer is yes, investors will be paid the full $0.38/share. There are several reasons for this:"
