title,date,body
NXP Semiconductors: One Stock You Don't Want Paying A Dividend,Feb. 8.15,"With a lot of tech companies now paying large dividends, from the nearly 3% at Intel (NASDAQ:INTC) to the 3.6% by Seagate Tech (NASDAQ:STX), NXP Semiconductors (NASDAQ:NXPI) is actually the one you don't want to see paying a dividend. NXP is benefiting from several trends in the tech world including the connected car and mobile payments such as Apple (NASDAQ:AAPL) Pay. As well, the semiconductor company benefits from a natural hedge to the euro collapse with a mixture of customers and operations in the area.The stock is up substantially in the last couple of years. Previous research suggested buying NXP back during the October sell off (see NXP Semiconductors: Perfect Storm Hits Stock), but is the dividend the key signal to owning this stock?Strong Q4 Benefited From Natural HedgeThe Netherlands-based firm has 20% of revenue denominated in the euro and around 60% of operating expenses. While U.S.-based tech companies saw several percentage points impact from the lower euro and higher dollar, NXP sees no material impact. When the euro plunges, top line revenue is slightly weaker, offset by lower operating expenses leading to a muted impact to the bottom line.NXP rode 81% YoY growth in the Secure Connected Device division to grow total revenues by 20% for the quarter. Without any impact from currency, earnings surged an even higher 26% to $1.35 and matched the typically strong Q3 numbers. The company produced $1.1 billion in free cash flow for the year.The numbers were so strong that the semiconductor company is only trading at 12.6x next years earnings despite the stock tripling in the last couple of years.No Dividends Until Better ValuedWith NXP having a market valuation in excess of $20 billion, the market of course wonders when the very profitable company will start paying dividends. It isn't like the company isn't returning capital to shareholders with stock repurchases of $1.4 billion during 2014. The company did an exceptional job of buying stock at an average price of $61.73 for the year."
Goldman: Buy during buyback blackout period,"Mar. 24, 2015 3:54 PM ET","Buyback-happy U.S. firms are prohibited from repurchasing shares from about five weeks prior to releasing quarterly earnings to about 48 hours after those reports. These blackout periods, says Goldman, may offer an especially tasty time for investors to pick up shares of their favorites.""High valuations in the absence of corporate demand may weigh on stock prices,"" says Goldman's Amanda Sneider, and particular areas of focus are tech, consumer discretionary, and financials - they've accounted for more than 50% of buyback activity.Goldman's buyback blackout theme buys: SanDisk (NASDAQ:SNDK), Yahoo (NASDAQ:YHOO), Travelers (NYSE:TRV), Apple (NASDAQ:AAPL), Juniper Networks (NYSE:JNPR), Xerox (NYSE:XRX), Torchmark (NYSE:TMK), F5 Networks (NASDAQ:FFIV), Citrix Systems (NASDAQ:CTXS), Aon (NYSE:AON), Moody's (NYSE:MCO), VeriSign (NASDAQ:VRSN), Hartford Financial (NYSE:HIG), Ameriprise (NYSE:AMP), Corning (NYSE:GLW), Time Warner (NYSE:TWX), Seagate Technology (NASDAQ:STX), Viacom (NASDAQ:VIAB), Legg Mason (NYSE:LM), XL Group (NYSE:XL), DirecTV (NASDAQ:DTV), Allstate (NYSE:ALL), Nvidia (NASDAQ:NVDA), CBS (NYSE:CBS), Macy's (NYSE:M), Kohl's (NYSE:KSS).Now read: Skip The Internet Of Things ETF And Buy This One IoT Stock Instead"
Motorola Solutions: Leveraging Stock Buybacks While Waiting For A Buyout,Feb.10.15,"Motorola Solutions (NYSE:MSI) continues to leverage large stock buybacks into strong earnings growth despite declines in revenue. The technology company recently reported strong quarterly earnings and Bloomberg released that the company is looking for a buyer. At a market cap of around $16 billion after the big gains on Monday, Motorola Solutions isn't going to be easy to unload for a sizeable premium. Investors though have plenty of reasons to wait around.Up For Sale?According to a report from Bloomberg, Motorola Solutions is looking to sell the business. The communications equipment supplier is struggling with stagnant revenue growth, but it is still growing earnings per share. The stock jumped to $70 in after hours trading on Friday based on the news of finding an advisor to find a buyer. It now sits at multi-year highs above $68, but it is clear that a deal isn't that imminent.The company earned $1.25 per share in the last quarter, easily surpassing analyst estimates by $0.14. The market though didn't like that revenue is essentially flat YoY and the company forecasts revenue declining up to 4% in 2015. Due to margin increases and stock buybacks, earnings are inline to surge from $2.58 earned in 2014 to $4.02 in 2016.Meeting those EPS targets would limit the reason to sell the stock without a decent premium.Reasons To WaitMotorola Solutions provides investors plenty of other reasons to wait in the stock for a potential buyout as highlighted in a previous article. First, the stock pays a solid 2.1% dividend. Second, the company is flush with cash and has plenty of cash flow that it's using to reduce the share count.During Q4, Motorola spent $1.5 billion on stock buybacks including the $750 million deal with ValueAct. In total, the company bought an incredible $2.5 billion on buybacks during 2014. Motorola has more than $4 billion remaining on the authorized stock buyback plan."
"Micron Technology: Given Future Potential, Patience Is A Virtue",Apr.27.15,"Recommendation: BUY. Target Price: $40.7 (Stock Price: $29.3 as of 04/23/2015, Upside: 40%)SummaryStrong demand and constrained supply set up Micron (NASDAQ:MU) to take advantage of the favorable memory chip industry condition. The DRAM industry has consolidated into three major competitors. Samsung (OTC:SSNLF), the biggest DRAM competitor with 42% of market share, is unlikely to oversupply the market or start a price war that would hurt DRAM manufacturers' margin. The lower NAND revenue guidance from SanDisk (SNDK) is a company-specific issue that was resulted from SanDisk management's poor planning and execution, and it had little to do with the future prospect of the NAND market. Micron's continued focus on technological innovation, its diversified product portfolio and healthy capital structure, and the favorable market condition all suggest Micron a buy.Why the stock is depressedThe DRAM industry had a long history of high rivalry among existing firms and high bargain power of customers, which pressured margins for Micron's core DRAM business (~68% of total MU revenue in 2014). In the past, the DRAM market was oversupplied by intense competition and was considered a commoditized market with high market fluctuation and price volatility. In 2014, Samsung invested $14.7B in building a new chip plant in South Korea with operations scheduled to begin during the second half of 2017. If Samsung utilizes this plant for DRAM and sets prices aggressively, it can oversupply the DRAM market and pressure Micron's core business. As this article suggests in later sections, aggressive pricing or oversupply is unlikely to happen as the DRAM industry consolidates and Samsung suffered from mobile sales loss."
Top 100 Dividend Stocks - 2015 Edition,"Jan. 3, 2015 12:06 AM ET","Ah! I have been rather quiet on this blog in the past few weeks, haven’t I? A big part of it was being incredibly busy, but also having little trading to do. That is about to change as we get ready for the New Year. First off, I’d like to wish all of you a very Happy New Year. To start off, before opening a few new long and short trades next week, I wanted to publish a recent edition of the top dividend payers in the S&P 500. In my next Ultimate Sustainable Dividend Portfolio update, I’ll certainly start looking for new names to be added. I always find this list to be very useful as a starting point.Again, I can’t stress enough how this list is only a starting point. Usually, the top players on this list are here because the company is doing poorly, resulting in a declining stock price, but the company has not (yet!) adjusted its dividend payout. Just take a look at Transocean’s (NYSE:RIG) stock chart:Why is it declining so quickly?Just take a quick look at these numbers:Here is the full list:TickerNamePriceDividend YieldPayout RatioEx-DvdRIG Transocean Ltd 18.33 16.37 63.79 2/18/2015WIN Windstream Holdings Inc 8.24 12.14 250.77 3/27/2015ESV Ensco PLC 29.95 10.02 36.9 03/12/2015DO Diamond Offshore Drilling Inc 36.71 9.53 88.69 02/12/2015NE Noble Corp plc 16.57 9.05 25.2 02/12/2015FTR Frontier Communications Corp 6.67 6.3 362.42 03/09/2015T AT&T Inc 33.59 5.6 53.13 01/07/2015CTL CenturyLink Inc 39.58 5.46 #VALUE! 2/27/2015FCX Freeport-McMoRan Inc 23.36 5.35 84.82 1/13/2015WMB Williams Cos Inc/The 44.94 5.07 222.62 03/11/2015HCP HCP Inc 44.03 4.95 106.92 02/05/2015IRM Iron Mountain Inc 38.66 4.91 213.91 3/18/2015MAT Mattel Inc 30.945 4.91 55.2 2/17/2015PM Philip Morris International Inc 81.45 4.91 68.07 3/24/2015OKE ONEOK Inc 49.79 4.74 117.5 1/28/2015VZ Verizon Communications Inc 46.78 4.7 51.73 01/07/2015VTR Ventas Inc 71.7 4.41 164.06 03/06/2015HCN Health Care REIT Inc 75.67 4.36 3110.77 02/05/2015PBCT People's United Financial Inc 15.18 4.35 87.67 1/28/2015TE TECO Energy Inc 20.49 4.29 96.66 2/13/2015SO Southern Co/The 49.11 4.28 107.36 02/05/2015COP ConocoPhillips 69.06 4.23 41.66 02/12/2015MO Altria Group Inc 49.27 4.22 81.21 3/13/2015RAI Reynolds American Inc 64.27 4.17 79.1 03/06/2015CCI Crown Castle International Corp 78.7 4.17 #VALUE! 3/17/2015KMI Kinder Morgan Inc/DE 42.31 4.16 138.48 1/30/2015PCL Plum Creek Timber Co Inc 42.79 4.11 135.51 02/11/2015PPL PPL Corp 36.33 4.1 79.79 03/09/2015HP Helmerich & Payne Inc 67.42 4.08 37.52 02/11/2015SE Spectra Energy Corp 36.3 4.08 80.56 02/04/2015CNP CenterPoint Energy Inc 23.43 4.05 114.15 2/17/2015WYNN Wynn Resorts Ltd 148.76 4.03 96.59 2/13/2015POM Pepco Holdings Inc 26.93 4.01 245.45 03/06/2015GME GameStop Corp 33.8 3.91 37.21 03/05/2015LO Lorillard Inc 62.94 3.91 69.92 2/25/2015ED Consolidated Edison Inc 66.01 3.82 67.89 02/09/2015CVX Chevron Corp 112.18 3.82 34.89 2/18/2015KIM Kimco Realty Corp 25.14 3.82 174.48 3/30/2015DUK Duke Energy Corp 83.54 3.81 82.38 02/11/2015ETR Entergy Corp 87.48 3.8 83.11 02/09/2015DRI Darden Restaurants Inc 58.63 3.75 157.37 01/07/2015FE FirstEnergy Corp 38.99 3.69 245.23 02/04/2015DOW Dow Chemical Co/The 45.61 3.69 34.14 3/30/2015GE General Electric Co 25.27 3.64 53.11 2/19/2015GRMN Garmin Ltd 52.83 3.63 57.44 03/12/2015MCD McDonald's Corp 93.7 3.63 55.76 2/27/2015COH Coach Inc 37.56 3.6 47.88 03/06/2015GAS AGL Resources Inc 54.51 3.6 70.93 02/12/2015PFE Pfizer Inc 31.15 3.6 57.68 02/04/2015PEG Public Service Enterprise Group Inc 41.41 3.58 58.57 03/06/2015OXY Occidental Petroleum Corp 80.61 3.57 34.84 03/09/2015AEE Ameren Corp 46.13 3.56 75.81 03/09/2015LYB LyondellBasell Industries NV 79.39 3.53 29.3 03/05/2015KRFT Kraft Foods Group Inc 62.66 3.51 45.05 3/30/2015TEG Integrys Energy Group Inc 77.85 3.5 61.84 2/27/2015AEP American Electric Power Co Inc 60.72 3.49 64.46 02/10/2015SCG SCANA Corp 60.4 3.48 60.3 03/11/2015PNW Pinnacle West Capital Corp 68.31 3.48 60.31 1/29/2015GM General Motors Co 34.91 3.44 0 3/13/2015PCG PG&E Corp 53.24 3.42 100.61 3/30/2015CINF Cincinnati Financial Corp 51.83 3.4 52.22 3/16/2015HST Host Hotels & Resorts Inc 23.77 3.36 169.52 3/27/2015EXC Exelon Corp 37.08 3.34 73.55 2/17/2015XEL Xcel Energy Inc 35.92 3.34 58.43 3/17/2015PAYX Paychex Inc 46.17 3.29 81.37 1/30/2015CA CA Inc 30.45 3.28 50.39 2/17/2015STX Seagate Technology PLC 66.5 3.25 35.85 2/13/2015F Ford Motor Co 15.5 3.23 22 1/28/2015WY Weyerhaeuser Co 35.89 3.23 84.95 2/25/2015WEC Wisconsin Energy Corp 52.74 3.21 56.96 02/11/2015DTE DTE Energy Co 86.37 3.2 68.53 3/19/2015MRK Merck & Co Inc 56.79 3.17 116.53 03/12/2015MCHP Microchip Technology Inc 45.11 3.16 71.14 2/18/2015HAS Hasbro Inc 54.99 3.13 72.88 1/30/2015MAC Macerich Co/The 83.41 3.12 252.35 2/18/2015D Dominion Resources Inc/VA 76.9 3.12 72.88 03/04/2015LMT Lockheed Martin Corp 192.57 3.12 52 2/25/2015CMS CMS Energy Corp 34.75 3.11 59.69 02/11/2015GIS General Mills Inc 53.33 3.08 53.41 01/08/2015PBI Pitney Bowes Inc 24.37 3.08 62.64 02/11/2015DNR Denbury Resources Inc 8.13 3.07 0 2/20/2015PLD Prologis Inc 43.03 3.07 288.82 03/09/2015CAT Caterpillar Inc 91.53 3.06 39.51 1/15/2015EMR Emerson Electric Co 61.73 3.05 56.36 2/18/2015NUE Nucor Corp 49.05 3.04 96.74 3/27/2015PSA Public Storage 184.85 3.03 105.02 03/12/2015SYY Sysco Corp 39.69 3.02 72.31 04/01/2015ABBV AbbVie Inc 65.44 3 76.99 1/13/2015K Kellogg Co 65.44 3 36.16 2/27/2015XOM Exxon Mobil Corp 92.45 2.99 34.31 02/05/2015IP International Paper Co 53.58 2.99 41.05 2/13/2015MRO Marathon Oil Corp 28.29 2.97 31.86 2/17/2015NU Northeast Utilities 53.52 2.93 58.87 2/27/2015WM Waste Management Inc 51.32 2.92 696.94 03/09/2015KMB Kimberly-Clark Corp 115.54 2.91 58.08 03/04/2015LEG Leggett & Platt Inc 42.61 2.91 89.99 3/13/2015CVC Cablevision Systems Corp 20.64 2.91 122.86 03/12/2015LLY Eli Lilly & Co 68.99 2.9 44.89 02/11/2015AES AES Corp/VA 13.77 2.9 43.11 1/30/2015KO Coca-Cola Co/The 42.22 2.89 57.85 03/11/2015"
Seagate Is In Trouble And Nobody Seems To Care,Aug.27.15,"Do you want to be an owner of this business?Quarterly Adjusted Net Income (in millions)The prudent investor, suspecting a trick question, should ask at what price? For Seagate (NASDAQ:STX), the answer is ~15x last quarter annualized earnings (of the adjusted variety). And in my opinion, earnings will continue to decline over time. So the diligent investor should perhaps conclude that the potential reward is nowhere close to compensating the investors for the risk.One could conclude Seagate is the perfect example of the current late-stage bull market: stock significantly higher than 2012 levels despite falling EPS? Check. Stock buybacks and acquisitions supported by leveraging the balance sheet with new debt? Check. Large chunk of passive/ETF investors? Check. Zero interest rate policy induced dividend buyers? Check. Sell-side analysts moving in a herd and ignoring secular risks? Check. Very light trading volumes and limited liquidity? Check. Investors have forgotten that this is a cyclical business? Check.A little housekeeping - readers can find most of the facts mentioned in this article on this handy page. The other facts and figures can be found in Seagate's and Western Digital's (NYSE:WDC) public disclosures (STX here and WDC here).First, let's talk about the risks to Seagate's business:Risk 1. Lower end-market demand due to weaker macro (i.e., we have entered a tech demand cycle)Tech demand is falling in lots of markets and especially in emerging economies. China is often discussed, but keep in mind many economies and currencies are plummeting (Russia, Brazil, Turkey, Malaysia, South Africa, Mexico, Kenya, Kazakhstan, etc.), and goods priced in USD are increasingly expensive for local consumers. Emerging market economies can't print money and have to implement painful fiscal adjustments. We will likely start seeing consumers in Europe and the US start to pull back on capex/expenditures. How much will US energy companies spend on the latest technology? I'd bet a lot less than they were."
Seagate Technologies Stock Analysis,Oct.12.15,"Now seems to be a pretty good time to perform a stock analysis as we approach the middle of the month! We have had ups and downs within the market, and it really can't decide which way it truly wants to go. With interest rates remaining on hold (thanks Fed, was really hoping for a bigger discount... kidding!), the market has been a tick upwards over the last 1-2 weeks. I wanted to hop into a sector and stock that has been beaten down this year with what is perceived to be sound dividend metrics. How about the technology sector? Seagate Technologies (NASDAQ:STX) - you are up!The Stock - Seagate Technologies (STX)Per Google Finance: ""Seagate Technology plc (Seagate) is a provider of electronic data storage products. The Company's products are hard disk drives (HDD). The Company produces a range of electronic data storage products, including solid state hybrid drives (SSHD), solid state drives (SSD), peripheral component interconnect express (PCIe) cards and Serial AT Attachment (SATA) controllers. The Company's products are designed for enterprise servers and storage systems for applications, client compute applications and client non-compute applications. The Company's product and solution portfolio for the enterprise data storage industry includes storage enclosures, integrated application platforms and high performance computing (HPC) data storage solutions. Its data storage services provide online backup, data protection and recovery solutions for small to medium-sized businesses. Its products include Enterprise Performance HDDs, Mobile HDDs and SSHDs, NAS HDDs, and Surveillance HDDs, among others."" Seagate is headquartered in Dublin, Ireland, and is massive in the data storage arena. The main competitors would be SanDisk and Western Digital Corp. At $15B in market capital, Seagate is in between the two competitors and offers some very valid metrics when looking at it from a dividend stock standpoint. No, this isn't a foundation stock, it is definitely far from an Emerson (NYSE:EMR) (which I have bought 3x) and does not even take a sniff at Bert's 5 always buy stocks. Definitely a different approach here."
Who Buys Micron?,Jun. 5.15,"OK, now that I have your attention, we can talk about further consolidation and ""deals"" in the memory business.Who needs to be in the memory business?China has declared the semiconductor business a strategic business. A general semiconductor industry without a memory component is a weak hand. So China would have a serious interest in being in the memory business.Seagate (NASDAQ:STX) and Western Digital (NYSE:WDC) absolutely need to be in the NAND business or face a rapid decline to shadow of their present size.It is interesting the WDC has a partnership with Intel on NAND and Seagate has a partnership with Micron on NAND. Of course this is the same NAND technology since the product is provided by the Intel (NASDAQ:INTC)/Micron (NASDAQ:MU) joint venture. I discussed this in a previous article.Intel is in the memory (storage) business, but has an adequate deal, for now, through the Intel/Micron joint venture, IMFT.Who, in the memory business is available to be acquired?Samsung (OTC:SSNLF) is out, of course.Hynix is probably out, and in any case is weak in NAND, which is the memory growth of the future.SanDisk (SNDK) is available. It is only NAND, which should be of intense interest to Seagate or Western Digital, less so to China.SanDisk is fully priced and with an acquisition premium would be quite expensive. Still, it would get either of the HDD (Hard Disk Drive) guys into the NAND business. I find it curious that neither of the HDD guys has made a move on SanDisk yet.Micron is available, but any offer would have to be in the $40/per share area. With low rates, either Seagate or Western Digital could probably pull it off with stock and borrowed money. The nice thing about Micron is that their current earnings would make the acquisition accretive to earnings for anyone who might be interested, even with all borrowed money.China could pull it off with what amounts to lunch money, but one might expect our government to have something to say about that. Micron, after all, is the only Western Hemisphere based broad line memory company, and is therefore pretty strategic to old Uncle Sam."
Intel/Micron Joint Venture Might Not Last After 2018,Jun.29.15,"I don't know how to say this as constructively as possible without sounding alarmist in front of my readers. But, basically, Intel (NASDAQ:INTC) and Micron (NASDAQ:MU) have this partnership in NAND flash, and there's a buyout clause for this partnership that may favor Micron overwhelmingly. Of course, there's no telling if Micron will actually exercise the call that will start in 2018. But, based on the language, a call would imply that they have the right but not the obligation to buy back the remainder of the IMFT partnership interest in which they own 51% of.Intel has performed poorly in light of Micron's weak quarter and upside from that joint venture is being capped.Source: AmigobullsSome of the contributors on Seeking Alpha got into the gory details about how 3D NAND flash had immense upside potential and why Intel's consumer CPU business has a supplementary sidekick in flash memory. So, even if worst comes to worst, and Intel is unable to generate ramping CPU volume, at least the ramp up in solid state storage devices would make up for the difference. Unfortunately, Intel had signed away its right to own the NAND business for much longer.Quoted from the 2014 Micron Annual Report (page 80):"
SanDisk: The Acquisition Target,Oct.14.15,"SanDisk (SNDK) has been the subject of numerous rumors as an acquisition target for quite a while now. Recent rumors have centered around either Micron (NASDAQ:MU) or Western Digital (NYSE:WDC) acquiring the NAND leader headed by one of the most recognized names in NVM (Non-Volatile Memory), Sanjay Mehrotra.I wrote an article that suggested the paired trade of long Micron and short SNDK, but I have remained purely long Micron while remaining on the sidelines on SanDisk for now. While I am convinced that Micron's prospects are phenomenal, I am far less certain on what lies ahead for SanDisk.In my prior article, I believed SanDisk would lose its cost advantage in NAND once Micron starts producing 3D NAND and Samsung (OTC:SSNLF) advanced another generation in its version of 3D NAND. Because of its lack of access to cheap DRAM, coupled with its loss of cost superiority in NAND, SanDisk seemed destined to be shut out of the rapidly growing smartphone MCP market. SanDisk is also likely far behind Micron (and Intel (NASDAQ:INTC)) in developing a next-generation non-volatile memory. Micron and Intel will have 3D XPoint products out in 2016. SanDisk has just recently formed an alliance with HP (NYSE:HPQ) that is attempting to create a next generation NVM that has similar performance specs to that of XPoint. Realistically, the SanDisk team is at least 2-3 years behind Micron and Intel right now. The gap might even be larger than that. I hypothesize that Samsung and SK Hynix (OTC:HXSCF) are at roughly the same juncture in the development of their respective responses to XPoint."
Western Digital And SanDisk Are Planning A Funeral For The HDD,Oct.22.15,"With Western Digital (NYSE:WDC) now set to acquire NAND manufacturer SanDisk (SNDK), the foggy technology roadmap for Western Digital (and the HDD (Hard Disk Drive) in general) is starting to become clear. Sales at Western Digital and Seagate (NASDAQ:STX) peaked in the 2012-13 timeframe and have since started to taper off by single-digit percentages annually. Talk of the ""death of the PC"" and by extension, ""death of the HDD,"" has been discussed for years. However, HDD sales at the two giants of the industry have only dipped a bit (pun intended) in the last two years. The era of a slow decline in HDD sales is coming to an end soon. If the NAND manufacturers are not wildly off in their predictions, HDD sales are about to experience enormous drops within 3 years.Western Digital's desire to acquire SanDisk is simple to understand - Western Digital needs to find a source of revenue in its post-HDD era. SanDisk is the cost leader in production of planar NAND flash, the NVM (non-volatile memory) that serves as the underlying technology that allows for the storage of data in SSDs (Solid State Drives). Relative to HDDs, SSDs are faster, more durable, weigh less and consume less power (and therefore emit less heat). In a nutshell, virtually all performance metrics of SSDs (that do not involve cost) are significantly better than those of HDDs. Unsurprisingly, everyone who has followed the storage industry knows with certainty that SSDs will eventually completely replace HDDs. The only question that remains is ""When will it happen""?I wrote an article in September that discusses the issue of when HDD sales will fall off a cliff. NAND manufacturers are building out their various versions of 3D NAND to increase the density of NAND dies, which equates to lowering the cost per bit. The NAND manufacturers plan to continuously lower the cost of NAND and get the price per GB of SSDs close to that of HDDs. While Samsung (OTC:SSNLF), SK Hynix (OTC:HXSCF), SanDisk (with Toshiba (OTCPK:TOSYY)) and Micron (NASDAQ:MU) (with Intel (NASDAQ:INTC)) have been working on lowering the cost of NAND, Western Digital and Seagate have been trying to delay the death of the HDD by also finding new ways to improve their technology (increase areal density) to lower the cost per GB of HDDs. The rate of decline in cost per bit for 3D NAND will be (significantly) higher than that of HDDs. With the estimates I used in the article, I estimated the big drop in HDD sales would occur sometime between late-2018 and early-2027."
